,Unnamed: 0,section,title,page_no,content,tagged_content
126,126,10.1.2,Representing electric circuits,188,Components of electrical circuits Some common elements (components) which can be found in electrical circuits include light bulbs batteries connecting leads switches resistors voltmeters and ammeters. You will learn more about these items in later sections but it is important to know what their symbols are and how to represent them in circuit diagrams. Below is table with the items and their symbols: Circuit diagrams Definition: Representing circuits physical circuit is the electric circuit you create with real components. circuit diagram is drawing which uses symbols to represent the different components in the physical circuit. We use circuit diagrams to represent circuits because they are much simpler and more general than drawing the physical circuit because they only show the workings of the electrical compo- nents. You can see this in the two pictures below. The first picture shows the physical circuit for an electric torch. You can see the light bulb the batteries the switch and the outside plastic casing of the torch. The picture is actually cross-section of the torch so that we can see inside it. Figure 10.1: Physical components of an electric torch. The dotted line shows the path of the electrical circuit. Below is the circuit diagram for the electric torch. Now the light bulb is represented by its symbol as are the batteries the switch and the connecting wires. It is not necessary to show the plastic casing of the torch since it has nothing to do with the electric workings of the torch. You can see that the circuit diagram is much simpler than the physical circuit drawing Series and parallel circuits There are two ways to connect electrical components in circuit: in series or in parallel. Definition: Series circuit In series circuit the charge has single path from the battery returning to the battery. Definition: Parallel circuit In parallel circuit the charge has multiple paths from the battery returning to the battery. The picture below shows circuit with three resistors connected in series on the left and circuit with three resistors connected in parallel on the right: ,Plasticity (physics)|Plasticity (physics)|Light|Light|Light|Work (physics)|Work (physics)|Electric charge|Electric charge|Voltmeter|Series and parallel circuits|Series and parallel circuits|Series and parallel circuits|Series and parallel circuits|Series and parallel circuits|Physics|Physics|Physics|Physics|Physics|Physics|Ammeter
127,127,10.2,Potential Difference,192,,
128,128,10.2.1,Potential Difference,192,When circuit is connected and is complete circuit charge can move through the circuit. Charge will not move unless there is reason force. Think of it as though charge is at rest and something has to push it along. This means that work needs to be done to make charge move. force acts on the charges doing work to make them move. The force is provided by the battery in the circuit. We call the moving charge current and we will talk about this later. The position of the charge in the circuit tells you how much potential energy it has because of the force being exerted on it. This is like the force from gravity the higher an object is above the ground (position) the more potential energy it has. The amount of work to move charge from one point to another point is how much the potential energy has changed. This is the difference in potential energy called potential difference. Notice that it is difference between the value of potential energy at two points so we say that potential difference is measured between or across two points. We do not say potential difference through something. Definition: Potential Difference Electrical potential difference as the difference in electrical potential energy per unit charge between two points. The units of potential difference are the volt (V). The units are volt (V) which is the same as joule per coulomb the amount of work done per unit charge. Electrical potential difference is also called voltage. ,Coulomb|Gravity|Electric potential energy|Potential energy|Potential energy|Potential energy|Potential energy|Potential energy|Potential energy|Electric potential|Electric potential|Electric potential|Work (physics)|Work (physics)|Work (physics)|Work (physics)|Force|Force|Force|Force|Force|Le Sage's theory of gravitation|Position (vector)|Position (vector)|Voltage|Voltage|Voltage|Voltage|Voltage|Voltage|Voltage|Voltage|Voltage|Joule|Electric charge|Electric charge|Electric charge|Electric charge|Electric charge|Electric charge|Electric charge|Electric charge|Electric charge|Electric charge|Energy|Energy|Energy|Energy|Energy|Energy|Gravity of Earth|Electric current
129,129,10.2.2,Potential Difference and Parallel Resistors,193,When resistors are connected in parallel the start and end points for all the resistors are the same. These points have the same potential energy and so the potential difference between them is the same no matter what is put in between them. You can have one two or many resistors between the two points the potential difference will not change. You can ignore whatever components are between two points in circuit when calculating the difference between the two points. Look at the following circuit diagrams. The battery is the same in all cases all that changes is more resistors are added between the points marked by the black dots. If we were to measure the potential difference between the two dots in these circuits we would get the same answer for all three cases. Lets look at two resistors in parallel more closely. When you construct circuit you use wires and you might think that measuring the voltage in different places on the wires will make difference. This is not true. The potential difference or voltage measurement will only be different if you measure different set of components. All points on the wires that have no circuit components between them will give you the same measurements. All three of the measurements shown in the picture below will give you the same voltages. The different measurement points on the left have no components between them so there is no change in potential energy. Exactly the same applies to the different points on the right. When you measure the potential difference between the points on the left and right you will get the same answer. ,Potential energy|Potential energy|Voltage|Voltage|Voltage|Voltage|Voltage|Voltage|Voltage|Voltage|Energy|Energy|Voltmeter
130,130,10.2.3,Potential Difference and Series Resistors,194,When resistors are in series one after the other there is potential difference across each resistor. The total potential difference across set of resistors in series is the sum of the potential differences across each of the resistors in the set. This is the same as falling large distance under gravity or falling that same distance (difference) in many smaller steps. The total distance (difference) is the same. Look at the circuits below. If we measured the potential difference between the black dots in all of these circuits it would be the same just like we saw above. So we now know the total potential difference is the same across one two or three resistors. We also know that some work is required to make charge flow through each one each is step down in potential energy. These steps add up to the total drop which we know is the difference between the two dots. Let us look at this in bit more detail. In the picture below you can see what the different measurements for identical resistors in series could look like. The total voltage across all three resistors is the sum of the voltages across the individual resistors. ,Gravity|Potential energy|Work (physics)|Le Sage's theory of gravitation|Voltage|Voltage|Voltage|Voltage|Voltage|Voltage|Voltage|Distance|Distance|Distance|Electric charge|Energy|Gravity of Earth
131,131,10.2.4,Ohm's Law,194,The voltage is the change in potential energy or work done when charge moves between two points in the circuit. The greater the resistance to charge moving the more work that needs to be done. The work done or voltage thus depends on the resistance. The potential difference is proportional to the resistance. Definition: Ohms Law Voltage across circuit component is proportional to the resistance of the component. Use the fact that voltage is proportional to resistance to calculate what proportion of the total voltage of circuit will be found across each circuit element. We know that the total voltage is equal to V1 in the first circuit to V1 V2 in the second circuit and V1 V2 V3 in the third circuit. We know that the potential energy lost across resistor is proportional to the resistance of the component. The total potential difference is shared evenly across the total resistance of the circuit. This means that the potential difference per unit of resistance is Then the voltage across resistor is just the resistance times the potential difference per unit of resistance ,Potential energy|Potential energy|Work (physics)|Work (physics)|Work (physics)|Voltage|Voltage|Voltage|Voltage|Voltage|Voltage|Voltage|Voltage|Voltage|Voltage|Voltage|Electric charge|Electric charge|Energy|Energy|Ohm|Electrical |Electrical resistance and conductance|Electrical |Electrical resistance and conductance|Electrical |Electrical resistance and conductance|Electrical |Electrical resistance and conductance|Electrical |Electrical resistance and conductance|Electrical |Electrical resistance and conductance|Electrical |Electrical resistance and conductance|Electrical |Electrical resistance and conductance|Electrical |Electrical resistance and conductance|Electrical |Electrical resistance and conductance|Ohm's law
132,132,10.2.5,EMF,195,When you measure the potential difference across (or between) the terminals of battery you are measuring the electromotive force (emf) of the battery. This is how much potential energy the battery has to make charges move through the circuit. This driving potential energy is equal to the total potential energy drops in the circuit. This means that the voltage across the battery is equal to the sum of the voltages in the circuit. We can use this information to solve problems in which the voltages across elements in circuit add up to the emf. EMF Vtotal ,Potential energy|Potential energy|Potential energy|Force|Electromotive force|Electromotive force|Electromotive force|Electromotive force|Voltage|Voltage|Voltage|Voltage|Electric charge|Energy|Energy|Energy
133,133,10.3,Current,198,,
134,134,10.3.1,Flow of Charge,198,We have been talking about moving charge. We need to be able to deal with numbers how much charge is moving how fast is it moving? The concept that gives us this information is called current. Current allows us to quantify the movement of charge. When we talk about current we talk about how much charge moves past fixed point in circuit in one second. Think of charges being pushed around the circuit by the battery there are charges in the wires but unless there is battery they wont move. When one charge moves the charges next to it also move. They keep their spacing. If you had tube of marbles like in this picture. marble marble If you push one marble into the tube one must come out the other side. If you look at any point in the tube and push one marble into the tube one marble will move past the point you are looking at. This is similar to charges in the wires of circuit. If charge moves they all move and the same number move at every point in the circuit. ,Electric charge|Electric charge|Electric charge|Electric charge|Electric charge|Electric charge|Electric charge|Electric charge|Electric charge|Electric charge|Electric current|Electric current|Electric current
135,135,10.3.2,Current,198,Now that weve thought about the moving charges and visualised what is happening we need to get back to quantifying moving charge. Ive already told you that we use current but we still need to define it. Definition: Current Current is the rate at which charges moves past fixed point in circuit. We use the symbol to show current and it is measured in amperes (A). One ampere is one coulomb of charge moving in one second. When current flows in circuit we show this on diagram by adding arrows. The arrows show the direction of flow in circuit. By convention we say that charge flows from the positive terminal on battery to the negative terminal. ,Coulomb|Position (vector)|Electric charge|Electric charge|Electric charge|Electric charge|Electric charge|Direction (geometry)|Electric current|Electric current|Electric current|Electric current|Electric current
136,136,10.3.3,Series Circuits,199,In series circuit the charge has single path from the battery returning to the battery. The arrows in this picture show you the direction that charge will flow in the circuit. They dont show you much charge will flow only the direction. Benjamin Franklin made guess about the direction of charge flow when rubbing smooth wax with rough wool. He thought that the charges flowed from the wax to the wool (i.e. from positive to negative) which was opposite to the real direction. Due to this electrons are said to have negative charge and so objects which Ben Franklin called negative (meaning shortage of charge) really have an excess of electrons. By the time the true direction of electron flow was discovered the convention of positive and negative had already been so well accepted in the scientific world that no effort was made to change it. Important: cell does not produce the same amount of current no matter what is connected to it. While the voltage produced by cell is constant the amount of current supplied depends on what is in the circuit. How does the current through the battery in circuit with several resistors in series compare to the current in circuit with single resistor? ,Position (vector)|Position (vector)|Voltage|Electron|Electron|Electron|Electric charge|Electric charge|Electric charge|Electric charge|Electric charge|Electric charge|Electric charge|Direction (geometry)|Direction (geometry)|Direction (geometry)|Direction (geometry)|Direction (geometry)|Series and parallel circuits|Electric current|Electric current|Electric current|Electric current
137,137,10.3.4,Parallel Circuits,200,How does the current through the battery in circuit with several resistors in parallel compare to the current in circuit with single resistor? Why is this the case? Why do more resistors make it easier for charge to flow in the circuit? It is because they are in parallel so there are more paths for charge to take to move. You can think of it like highway with more lanes or the tube of marbles splitting into multiple parallel tubes. The more branches there are the easier it is for charge to flow. You will learn more about the total resistance of parallel resistors later but always remember that more resistors in parallel mean more pathways. In series the pathways come one after the other so it does not make it easier for charge to flow. ,Electric charge|Electric charge|Electric charge|Electric charge|Electrical |Electrical resistance and conductance|Electric current|Electric current
138,138,10.4,Resistance,202,,
139,139,10.4.1,What causes resistance?,202,We have spoken about resistors that slow down the flow of charge in conductor. On microscopic level electrons moving through the conductor collide with the particles of which the conductor (metal) is made. When they collide they transfer kinetic energy. The electrons therefore lose kinetic energy and slow down. This leads to resistance. The transferred energy causes the conductor to heat up. You can feel this directly if you touch cellphone charger when you are charging cell phone the charger gets warm Definition: Resistance Resistance slows down the flow of charge in circuit. We use the symbol to show resistance and it is measured in units called Ohms with the symbol Ohm Volt Ampere All conductors have some resistance. For example piece of wire has less resistance than light bulb but both have resistance. The high resistance of the filament (small wire) in lightbulb causes the electrons to transfer lot of their kinetic energy in the form of heat. The heat energy is enough to cause the filament to glow white-hot which produces light. The wires connecting the lamp to the cell or battery hardly even get warm while conducting the same amount of current. This is because of their much lower resistance due to their larger cross-section (they are thicker). An important effect of resistor is that it converts electrical energy into other forms of energy such as heat and light. There is special type of conductor called superconductor that has no resistance but the materials that make up superconductors only start supercon- ducting at very low temperatures (approximately -170C). Why do batteries go flat? battery stores chemical potential energy. When it is connected in circuit chemical reaction takes place inside the battery which converts chemical potential energy to electrical energy which powers the electrons to move through the circuit. All the circuit elements (such as the conducting leads resistors and lightbulbs) have some resistance to the flow of charge and convert the electrical energy to heat andor light. The battery goes flat when all its chemical potential energy has been converted into other forms of energy. ,Potential energy|Potential energy|Potential energy|Light|Light|Light|Light|Optical microscope|Electron|Electron|Electron|Electron|Collision|Collision|Electric charge|Electric charge|Electric charge|Electric charge|Temperature|Energy|Energy|Energy|Energy|Energy|Energy|Energy|Energy|Energy|Energy|Energy|Energy|Energy|Ohm|Ohm|Power (physics)|Electrical conductor|Electrical conductor|Electrical conductor|Electrical conductor|Electrical conductor|Electrical conductor|Electrical |Electrical resistance and conductance|Electrical |Electrical resistance and conductance|Electrical |Electrical resistance and conductance|Electrical |Electrical resistance and conductance|Electrical |Electrical resistance and conductance|Electrical |Electrical resistance and conductance|Electrical |Electrical resistance and conductance|Electrical |Electrical resistance and conductance|Electrical |Electrical resistance and conductance|Electrical |Electrical resistance and conductance|Electrical |Electrical resistance and conductance|Kinetic energy|Kinetic energy|Kinetic energy|Electric current
140,140,10.4.2,Resistors in electric circuits,202,It is important to understand what effect adding resistors to circuit has on the total resistance of circuit and on the current that can flow in the circuit. Resistors in series When we add resistors in series to circuit we increase the resistance to the flow of current. There is only one path that the current can flow down and the current is the same at all places in the series circuit. Take look at the diagram below: On the left there is circuit with single resistor and battery. No matter where we measure the current it is the same in series circuit. On the right we have added second resistor in series to the circuit. The total resistance of the circuit has increased and you can see from the reading on the ammeter that the current in the circuit has decreased. Resistors in parallel In contrast to the series case when we add resistors in parallel we create more paths along which current can flow. By doing this we decrease the total resistance of the circuit Take look at the diagram below. On the left we have the same circuit as in the previous diagram with battery and resistor. The ammeter shows current of ampere. On the right we have added second resistor in parallel to the first resistor. This has increased the number of paths (branches) the charge can take through the circuit the total resistance has decreased. You can see that the current in the circuit has increased. Also notice that the current in the different branches can be different. ,Electric charge|Electrical |Electrical resistance and conductance|Electrical |Electrical resistance and conductance|Electrical |Electrical resistance and conductance|Electrical |Electrical resistance and conductance|Electrical |Electrical resistance and conductance|Series and parallel circuits|Series and parallel circuits|Electric current|Electric current|Electric current|Electric current|Electric current|Electric current|Electric current|Electric current|Electric current|Electric current|Ammeter|Ammeter
141,141,10.5,"Instruments to Measure voltage, current and resistance",204,As we have seen in previous sections an electric circuit is made up of number of different components such as batteries resistors and light bulbs. There are devices to measure the properties of these components. These devices are called meters. For example one may be interested in measuring the amount of current flowing through circuit using an ammeter or measuring the voltage provided by battery using voltmeter. In this section we will discuss the practical usage of voltmeters ammeters and ohmmeters. ,Light|Voltage|Metre|Ohmmeter|Voltmeter|Voltmeter|Electric current|Ammeter|Ammeter
142,142,10.5.1,Voltmeter,204,voltmeter is an instrument for measuring the voltage between two points in an electric circuit. In analogy with water circuit voltmeter is like meter designed to measure pressure difference. Since one is interested in measuring the voltage between two points in circuit voltmeter must be connected in parallel with the portion of the circuit on which the measurement is made. Figure 10.3: voltmeter should be connected in parallel in circuit. Figure 10.3 shows voltmeter connected in parallel with battery. One lead of the voltmeter is connected to one end of the battery and the other lead is connected to the opposite end. The voltmeter may also be used to measure the voltage across resistor or any other component of circuit that has voltage drop. ,Voltage|Voltage|Voltage|Voltage|Metre|Voltmeter|Voltmeter|Voltmeter|Voltmeter|Voltmeter|Voltmeter|Voltmeter
143,143,10.5.2,Ammeter,204,An ammeter is an instrument used to measure the flow of electric current in circuit. Since one is interested in measuring the current flowing through circuit component the ammeter must be connected in series with the measured circuit component (Figure 10.4). ,Electric current|Electric current|Ammeter|Ammeter
144,144,10.5.3,Ohmmeter,204,An ohmmeter is an instrument for measuring electrical resistance. The basic ohmmeter can function much like an ammeter. The ohmmeter works by suppling constant voltage to the resistor and measuring the current flowing through it. The measured current is then converted into corresponding resistance reading through Ohms Law. Ohmmeters only function correctly when measuring resistance that is not being powered by voltage or current source. In other words you cannot measure the resistance of component that is already connected to circuit. This is because the ohmmeters accurate indication depends only on its own source of voltage. The presence of any other voltage across the measured circuit component interferes with the ohmmeters operation. Figure 10.5 shows an ohmmeter connected with resistor. ,Work (physics)|Voltage|Voltage|Voltage|Voltage|Ohm|Power (physics)|Electrical |Electrical resistance and conductance|Electrical |Electrical resistance and conductance|Electrical |Electrical resistance and conductance|Electrical |Electrical resistance and conductance|Ohmmeter|Ohmmeter|Ohmmeter|Ohmmeter|Ohmmeter|Ohmmeter|Ohmmeter|Ohmmeter|Ohm's law|Electric current|Electric current|Electric current|Ammeter|Ammeter
145,145,10.5.4,Meters Impact on Circuit,205,good quality meter used correctly will not significantly change the values it is used to measure. This means that an ammeter has very low resistance to not slow down the flow of charge. voltmeter has very high resistance so that it does not add another parallel pathway to the circuit for the charge to flow along. ,Metre|Electric charge|Electric charge|Electrical |Electrical resistance and conductance|Electrical |Electrical resistance and conductance|Voltmeter|Ammeter
146,146,11,Vectors,211,,
147,147,11.1,Introduction,211,This chapter focuses on vectors. We will learn what is vector how it differs from everyday numbers how to add subtract and multiply them and where they appear in Physics. Are vectors Physics? No vectors themselves are not Physics. Physics is just description of the world around us. To describe something we need to use language. The most common language used to describe Physics is Mathematics. Vectors form very important part of the mathematical description of Physics so much so that it is absolutely essential to master the use of vectors. ,Euclidean vector|Euclidean vector|Euclidean vector|Euclidean vector|Euclidean vector|Euclidean vector|Physics|Physics|Physics|Physics|Physics|Physics
