,Unnamed: 0,section,title,page_no,content,tagged_content
230,230,15.6,SONAR,368,Ships on the ocean make use of the reflecting properties of sound waves to determine the depth of the ocean. sound wave is transmitted and bounces off the seabed. Because the speed of sound is known and the time lapse between sending and receiving the sound can be measured the distance from the ship to the bottom of the ocean can be determined This is called sonar which stands from Sound Navigation And Ranging. ,Speed|Sound|Sound|Sound|Sound|Sound|Wave|Wave|Distance|Reflection (physics)
231,231,15.6.1,Echolocation,368,Animals like dolphins and bats make use of sounds waves to find their way. Just like ships on the ocean bats use sonar to navigate. Ultrasound waves that are sent out are reflected off the objects around the animal. Bats or dolphins then use the reflected sounds to form picture of their surroundings. This is called echolocation. ,Sound|Sound|Wave|Wave|Reflection (physics)|Reflection (physics)
232,232,16,The Physics of Music,373,,
233,233,16.1,Introduction,373,What is your favorite musical instrument? How do you play it? Do you pluck string like guitar? Do you blow through it like flute? Do you hit it like drum? All of these work by making standing waves. Each instrument has unique sound because of the special waves made in it. These waves could be in the strings of guitar or violin. They could also be in the skin of drum or tube of air in trumpet. These waves are picked up by the air and later reach your ear as sound. In Grade 10 you learned about standing waves and boundary conditions. We saw rope that was: fixed at both ends fixed at one end and free at the other We also saw pipe: closed at both ends open at both ends open at one end closed at the other String and wind instruments are good examples of standing waves on strings and pipes. One way to describe standing waves is to count nodes. Recall that node is point on string that does not move as the wave changes. The anti-nodes are the highest and lowest points on the wave. There is node at each end of fixed string. There is also node at the closed end of pipe. But an open end of pipe has an anti-node. What causes standing wave? There are incident and reflected waves traveling back and forth on our string or pipe. For some frequencies these waves combine in just the right way so that the whole wave appears to be standing still. These special cases are called harmonic frequencies or harmonics. They depend on the length and material of the medium. Definition: Harmonic harmonic frequency is frequency at which standing waves can be made. ,Frequency|Frequency|Frequency|Frequency|Work (physics)|Sound|Sound|Standing wave|Standing wave|Standing wave|Standing wave|Standing wave|Standing wave|Wave|Wave|Wave|Wave|Wave|Wave|Wave|Wave|Wave|Wave|Wave|Wave|Wave|Wave|Reflection (physics)|Length
234,234,16.2,Standing Waves in String Instruments,373,Let us look at basic instrument: string pulled tight and fixed at both ends. When you pluck the string you hear certain pitch. This pitch is made by certain frequency. What causes the string to emit sounds at this pitch? You have learned that the frequency of standing wave depends on the length of the wave. The wavelength depends on the nodes and anti-nodes. The longest wave that can fit on the string is shown in Figure 16.1. This is called the fundamental or natural frequency of the string. The string has nodes at both ends. The wavelength of the fundamental is twice the length of the string. Now put your finger on the center of the string. Hold it down gently and pluck it. The standing wave now has node in the middle of the string. There are three nodes. We can fit whole wave between the ends of the string. This means the wavelength is equal to the length of the string. This wave is called the first harmonic. As we add more nodes we find the second harmonic third harmonic and so on. We must keep the nodes equally spaced or we will lose our standing wave. You should have found this formula: 2L Here is the number of nodes. is the length of the string. The frequency is: Here is the velocity of the wave. This may seem confusing. The wave is standing wave so how can it have velocity? But one standing wave is made up of many waves that travel back and forth on the string. Each of these waves has the same velocity. This speed depends on the mass and tension of the string. Extension: Guitar Guitars use strings with high tension. The length tension and mass of the strings affect the pitches you hear. High tension and short strings make high frequencies Low tension and long strings make low frequencies. When string is first plucked it vibrates at many frequencies. All of these except the harmonics are quickly filtered out. The harmonics make up the tone we hear. The body of guitar acts as large wooden soundboard. Here is how soundboard works: the body picks up the vibrations of the strings. It then passes these vibrations to the air. sound hole allows the soundboard of the guitar to vibrate more freely. It also helps sound waves to get out of the body. The neck of the guitar has thin metal bumps on it called frets. Pressing string against fret shortens the length of that string. This raises the natural frequency and the pitch of that string. Most guitars use an equal tempered tuning of 12 notes per octave. string guitar has range of octaves with pitches from 82.407 Hz (low E) to 2093 kHz (high C). Harmonics may reach over 20 kHz in the inaudible range. Extension: Piano Let us look at another stringed instrument: the piano. The piano has strings that you can not see. When key is pressed felt-tipped hammer hits string inside the piano. The pitch depends on the length tension and mass of the string. But there are many more strings than keys on piano. This is because the short and thin strings are not as loud as the long and heavy strings. To make up for this the higher keys have groups of two to four strings each. The soundboard in piano is large cast iron plate. It picks up vibrations from the strings. This heavy plate can withstand over 200 tons of pressure from string tension Its mass also allows the piano to sustain notes for long periods of time. The piano has wide frequency range from 275 Hz (low A) to 41860 Hz (upper C). But these are just the fundamental frequencies. piano plays complex rich tones with over 20 harmonics per note. Some of these are out of the range of human hearing. Very low piano notes can be heard mostly because of their higher harmonics. ,Wavelength|Wavelength|Wavelength|Velocity|Velocity|Velocity|Frequency|Frequency|Frequency|Frequency|Frequency|Frequency|Frequency|Frequency|Frequency|Frequency|Mass|Mass|Mass|Mass|Work (physics)|Speed|Sound|Sound|Sound|Standing wave|Standing wave|Standing wave|Standing wave|Standing wave|Wave|Wave|Wave|Wave|Wave|Wave|Wave|Wave|Wave|Wave|Wave|Wave|Wave|Wave|Hertz|Hertz|Hertz|Tension (physics)|Tension (physics)|Tension (physics)|Tension (physics)|Tension (physics)|Tension (physics)|Tension (physics)|Length|Length|Length|Length|Length|Length|Length|Musical tone|Musical tone|Pitch (music)|Pitch (music)|Pitch (music)|Pitch (music)|Pitch (music)|Pitch (music)|Pitch (music)
235,235,16.3,Standing Waves in Wind Instruments,377,wind instrument is an instrument that is usually made with pipe or thin tube. Examples of wind instruments are recorders clarinets flutes organs etc. When one plays wind instrument the air that is pushed through the pipe vibrates and standing waves are formed. Just like with strings the wavelengths of the standing waves will depend on the length of the pipe and whether it is open or closed at each end. Lets consider each of the following situations: pipe with both ends open like flute or organ pipe. pipe with one end open and one closed like clarinet. If you blow across small hole in pipe or reed it makes sound. If both ends are open standing waves will form according to figure 16.2. You will notice that there is an anti-node at each end. In the next activity you will find how this affects the wavelengths. The formula is different because there are more anti-nodes than nodes. The right formula is: Here is still the number of nodes. long wavelength has low frequency and low pitch. If you took your pipe from the last example and covered one end you should hear much lower note Also the wavelengths of the harmonics for this tube are not integer multiples of each other. Extension: Musical Scale The 12 tone scale popular in Western music took centuries to develop. This scale is also called the 12-note Equal Tempered scale. It has an octave divided into 12 steps. (An octave is the main interval of most scales. If you double frequency you have raised the note one octave.) All steps have equal ratios of frequencies. But this scale is not perfect. If the octaves are in tune all the other intervals are slightly mistuned. No interval is badly out of tune. But none is perfect. For example suppose the base note of scale is frequency of 110 Hz low A). The first harmonic is 220 Hz. This note is also an but is one octave higher. The second harmonic is at 330 Hz (close to an E). The third is 440 Hz (also an A). But not all the notes have such simple ratios. Middle has frequency of about 262 Hz. This is not simple multiple of 110 Hz. So the interval between and is little out of tune. Many other types of tuning exist. Just Tempered scales are tuned so that all intervals are simple ratios of frequencies. There are also equal tempered scales with more or less notes per octave. Some scales use as many as 31 or 53 notes. ,Wavelength|Wavelength|Wavelength|Wavelength|Frequency|Frequency|Frequency|Frequency|Frequency|Frequency|Sound|Standing wave|Standing wave|Standing wave|Wave|Wave|Wave|Hertz|Hertz|Hertz|Hertz|Hertz|Hertz|Length|Musical tone|Pitch (music)
236,236,16.4,Resonance,382,Resonance is the tendency of system to vibrate at maximum amplitude at the natural frequency of the system. Resonance takes place when system is made to vibrate at its natural frequency as result of vibrations that are received from another source of the same frequency. In the following investigation you will measure the speed of sound using resonance. Interesting fact: Soldiers march out of time on bridges to avoid stimulating the bridge to vibrate at its natural frequency. From the investigation you will notice that the column of air will make sound at certain length. This is where resonance takes place. ,Frequency|Frequency|Frequency|Frequency|Resonance (particle physics)|Resonance (particle physics)|Resonance (particle physics)|Resonance (particle physics)|Amplitude|Speed|Sound|Sound|Length
237,237,16.5,Music and Sound Quality,384,In the sound chapter we referred to the quality of sound as its tone. What makes the tone of note played on an instrument? When you pluck string or vibrate air in tube you hear mostly the fundamental frequency. Higher harmonics are present but are fainter. These are called overtones. The tone of note depends on its mixture of overtones. Different instruments have different mixtures of overtones. This is why the same note sounds different on flute and piano. Let us see how overtones can change the shape of wave: The resultant waveform is very different from the fundamental frequency. Even though the two waves have the same main frequency they do not sound the same ,Frequency|Frequency|Frequency|Sound|Sound|Sound|Sound|Wave|Wave|Musical tone|Musical tone|Musical tone
238,238,17,Electrostatics,387,,
239,239,17.1,Introduction,387,In Grade 10 you learnt about the force between charges. In this chapter you will learn exactly how to determine this force and about basic law of electrostatics. ,Force|Force|Electric charge|Electrostatics
240,240,17.2,Forces between charges - Coulomb's Law,387,Like charges repel each other while opposite charges attract each other. If the charges are at rest then the force between them is known as the electrostatic force. The electrostatic force between charges increases when the magnitude of the charges increases or the distance between the charges decreases. The electrostatic force was first studied in detail by Charles Coulomb around 1784. Through his observations he was able to show that the electrostatic force between two point-like charges is inversely proportional to the square of the distance between the objects. He also discovered that the force is proportional to the product of the charges on the two objects. Q1Q2 r2 where Q1 is the charge on the one point-like object Q2 is the charge on the second and is the distance between the two. The magnitude of the electrostatic force between two point-like charges is given by Coulombs Law. Definition: Coulombs Law Coulombs Law states that the magnitude of the electrostatic force between two point charges is directly proportional to the magnitudes of each charge and inversely proportional to the square of the distance between the charges. Q1Q2 r2 and the proportionality constant is called the electrostatic constant and has the value: 899 109N m2 C2. Extension: Similarity of Coulombs Law to the Newtons Universal Law of Gravitation. Notice how similar Coulombs Law is to the form of Newtons Universal Law of Gravitation between two point-like particles: where m1 and m2 are the masses of the two particles is the distance between them and is the gravitational constant. Both laws represent the force exerted by particles (masses or charges) on each other that interact by means of field. It is very interesting that Coulombs Law has been shown to be correct no matter how small the distance nor how large the charge. For example it still applies inside the atom (over distances smaller than 1010m). Next is another example that demonstrates the difference in magnitude between the gravitational force and the electrostatic force. Important: We can apply Newtons Third Law to charges because two charges exert forces of equal magnitude on one another in opposite directions. Important: Coulombs Law When substituting into the Coulombs Law equation it is not necessary to include the signs of the charges. Instead select positive direction. Then forces that tend to move the charge in this direction are added while forces that act in the opposite direction are subtracted. We mentioned in Chapter that charge placed on spherical conductor spreads evenly along the surface. As result if we are far enough from the charged sphere electrostatically it behaves as point-like charge. Thus we can treat spherical conductors (e.g. metallic balls) as point-like charges with all the charge acting at the centre. ,Coulomb|Coulomb|Coulomb|Coulomb|Coulomb|Coulomb|Coulomb|Coulomb|Coulomb|Mass|Mass|Coulomb's law|Coulomb's law|Coulomb's law|Coulomb's law|Coulomb's law|Coulomb's law|Coulomb's law|Coulomb's law|Force|Force|Force|Force|Force|Force|Force|Force|Force|Force|Force|Force|Force|Force|Newton's law of universal gravitation|Newton's law of universal gravitation|Newton's law of universal gravitation|Position (vector)|Distance|Distance|Distance|Distance|Distance|Distance|Distance|Electric charge|Electric charge|Electric charge|Electric charge|Electric charge|Electric charge|Electric charge|Electric charge|Electric charge|Electric charge|Electric charge|Electric charge|Electric charge|Electric charge|Electric charge|Electric charge|Electric charge|Electric charge|Electric charge|Electric charge|Electric charge|Electric charge|Electric charge|Electric charge|Electric charge|Electric charge|Electric charge|Direction (geometry)|Direction (geometry)|Direction (geometry)|Direction (geometry)|Electrostatics|Electrostatics|Electrostatics|Electrostatics|Electrostatics|Electrostatics|Electrostatics|Electrostatics|Electrostatics|Electrical conductor|Electrical conductor|Field (physics)|Gravitational constant
241,241,17.3,Electric field around charges,392,We have learnt that objects that carry charge feel forces from all other charged objects. It is useful to determine what the effect of charge would be at every point surrounding it. To do this we need some sort of reference. We know that the force that one charge feels due to another depends on both charges (Q1 and Q2). How then can we talk about forces if we only have one charge? The solution to this dilemma is to introduce test charge. We then determine the force that would be exerted on it if we placed it at certain location. If we do this for every point surrounding charge we know what would happen if we put test charge at any location. This map of what would happen at any point we call an electric field map. It is map of the electric field due to charge. It tells us how large the force on test charge would be and in what direction the force would be. Our map consists of the lines that tell us how the test charge would move if it were placed there. Definition: Electric field An electric field as region of space in which an electric charge experiences force. The direction of the electric field at point is the direction that positive test charge would move if placed at that point. ,Electric field|Electric field|Electric field|Electric field|Electric field|Force|Force|Force|Force|Force|Force|Force|Position (vector)|Electric charge|Electric charge|Electric charge|Electric charge|Electric charge|Electric charge|Electric charge|Electric charge|Electric charge|Electric charge|Electric charge|Electric charge|Electric charge|Electric charge|Electric charge|Electric charge|Direction (geometry)|Direction (geometry)|Direction (geometry)|Field (physics)|Field (physics)|Field (physics)|Field (physics)|Field (physics)
242,242,17.3.1,Electric field lines,393,The maps depend very much on the charge or charges that the map is being made for. We will start off with the simplest possible case. Take single positive charge with no other charges around it. First we will look at what effects it would have on test charge at number of points. Electric field lines like the magnetic field lines that were studied in Grade 10 are way of representing the electric field at point. Arrows on the field lines indicate the direction of the field i.e. the direction positive test charge would move. Electric field lines therefore point away from positive charges and towards negative charges. Field lines are drawn closer together where the field is stronger. ,Magnet|Electric field|Electric field|Electric field|Position (vector)|Position (vector)|Position (vector)|Magnetic field|Magnetism|Electric charge|Electric charge|Electric charge|Electric charge|Electric charge|Electric charge|Electric charge|Electric charge|Direction (geometry)|Direction (geometry)|Field (physics)|Field (physics)|Field (physics)|Field (physics)|Field (physics)|Field (physics)|Field (physics)|Field (physics)|Field line|Field line|Field line|Field line|Field line
243,243,17.3.2,Positive charge acting on a test charge,393,At each point we calculate the force on test charge and represent this force by vector. We can see that at every point the positive test charge would experience force pushing it away from the charge Q. This is because both charges are positive and so they repel. Also notice that at points further away the vectors are shorter. That is because the force is smaller if you are further away. Negative charge acting on test charge If the charge were negative we would have the following result. Notice that it is almost identical to the positive charge case. This is important the arrows are the same length because the magnitude of the charge is the same and so is the magnitude of the test charge. Thus the magnitude (size) of the force is the same. The arrows point in the opposite direction because the charges now have opposite sign and so the test charge is attracted to the charge. Now to make things simpler we draw continuous lines showing the path that the test charge would travel. This means we dont have to work out the magnitude of the force at many different points. Some important points to remember about electric fields: There is an electric field at every point in space surrounding charge. Field lines are merely representation they are not real. When we draw them we just pick convenient places to indicate the field in space. Field lines always start at right-angle (90o) to the charged object causing the field. Field lines never cross. ,Work (physics)|Electric field|Electric field|Force|Force|Force|Force|Force|Force|Position (vector)|Position (vector)|Position (vector)|Electric charge|Electric charge|Electric charge|Electric charge|Electric charge|Electric charge|Electric charge|Electric charge|Electric charge|Electric charge|Electric charge|Electric charge|Electric charge|Electric charge|Electric charge|Electric charge|Electric charge|Direction (geometry)|Euclidean vector|Euclidean vector|Field (physics)|Field (physics)|Field (physics)|Field (physics)|Field (physics)|Field (physics)|Field (physics)|Field line|Field line|Field line|Length
244,244,17.3.3,Combined charge distributions,394,We will now look at the field of positive charge and negative charge placed next to each other. The net resulting field would be the addition of the fields from each of the charges. To start off with let us sketch the field maps for each of the charges separately. Notice that test charge starting off directly between the two would be pushed away from the positive charge and pulled towards the negative charge in straight line. The path it would follow would be straight line between the charges. Now lets consider test charge starting off bit higher than directly between the charges. If it starts closer to the positive charge the force it feels from the positive charge is greater but the negative charge also attracts it so it would move away from the positive charge with tiny force attracting it towards the negative charge. As it gets further from the positive charge the force from the negative and positive charges change and they are equal in magnitude at equal distances from the charges. After that point the negative charge starts to exert stronger force on the test charge. This means that the test charge moves towards the negative charge with only small force away from the positive charge. Two like charges both positive For the case of two positive charges things look little different. We cant just turn the arrows around the way we did before. In this case the test charge is repelled by both charges. This tells us that test charge will never cross half way because the force of repulsion from both charges will be equal in magnitude. The field directly between the charges cancels out in the middle. The force has equal magnitude and opposite direction. Interesting things happen when we look at test charges that are not on line directly between the two. We know that charge the same distance below the middle will experience force along reflected line because the problem is symmetric (i.e. if we flipped vertically it would look the same). This is also true in the horizontal direction. So we use this fact to easily draw in the next four lines. Two like charges both negative We can use the fact that the direction of the force is reversed for test charge if you change the sign of the charge that is influencing it. If we change to the case where both charges are negative we get the following result: ,Force|Force|Force|Force|Force|Force|Force|Force|Force|Position (vector)|Position (vector)|Position (vector)|Position (vector)|Position (vector)|Position (vector)|Position (vector)|Position (vector)|Position (vector)|Position (vector)|Distance|Distance|Electric charge|Electric charge|Electric charge|Electric charge|Electric charge|Electric charge|Electric charge|Electric charge|Electric charge|Electric charge|Electric charge|Electric charge|Electric charge|Electric charge|Electric charge|Electric charge|Electric charge|Electric charge|Electric charge|Electric charge|Electric charge|Electric charge|Electric charge|Electric charge|Electric charge|Electric charge|Electric charge|Electric charge|Electric charge|Electric charge|Electric charge|Electric charge|Electric charge|Electric charge|Electric charge|Electric charge|Direction (geometry)|Direction (geometry)|Direction (geometry)|Reflection (physics)|Field (physics)|Field (physics)|Field (physics)|Field (physics)|Field (physics)
