,Unnamed: 0,section,title,page_no,content,tagged_content
0,0,1,What is Physics?,3,Physics is the study of the world around us. In sense we are more qualified to do physics than any other science. From the day we are born we study the things around us in an effort to understand how they work and relate to each other. Learning how to catch or throw ball is physics undertaking for example. In the field of study we refer to as physics we just try to make the things everyone has been studying more clear. We attempt to describe them through simple rules and mathematics. Mathematics is merely the language we use. The best approach to physics is to relate everything you learn to things you have already noticed in your everyday life. Sometimes when you look at things closely you discover things you had overlooked intially. It is the continued scrutiny of everything we know about the world around us that leads people to the lifelong study of physics. You can start with asking simple question like Why is the sky blue? which could lead you to electromagnetic waves which in turn could lead you wave particle duality and to energy levels of atoms and before long you are studying quantum mechanics or the structure of the universe. In the sections that follow notice that we will try to describe how we will communicate the things we are dealing with. This is our langauge. Once this is done we can begin the adventure of looking more closely at the world we live in. ntsDescriptions relating to these questions must be included: What is meant by theory? How does hypothesis become part of law? (a) Define the term laboratory. (b) How does your schools physics laboratory fit this definition? Distinguish between science and technology. ,Energy level|Work (physics)|Wave|Wave|Energy|Field (physics)|Physics|Physics|Physics|Physics|Physics|Physics|Physics
1,1,2,Units,9,,
2,2,2.1,Introduction,9,Imagine you had to make curtains and needed to buy fabric. The shop assistant would need to know how much fabric you needed. Telling her you need fabric wide and long would be insufficient you have to specify the unit (i.e. metres wide and metres long). Without the unit the information is incomplete and the shop assistant would have to guess. If you were making curtains for dolls house the dimensions might be centimetres wide and centimetres long It is not just lengths that have units all physical quantities have units (e.g. time temperature distance etc.). Definition: Physical Quantity physical quantity is anything that you can measure. For example length temperature distance and time are physical quantities. ,Distance|Distance|Metre|Metre|Physical quantity|Physical quantity|Physical quantity|Physical quantity|Temperature|Temperature|Length|Length|Physics|Physics|Physics|Physics
3,3,2.2,Unit Systems,9,,
4,4,2.2.1,SI Units,9,We will be using the SI units in this course. SI units are the internationally agreed upon units. Historically these units are based on the metric system which was developed in France at the time of the French Revolution. Definition: SI Units The name SI units comes from the French Systeme International dUnites which means international system of units. There are seven base SI units. These are listed in Table 2.1. All physical quantities have units which can be built from these seven base units. These seven units were defined to be the base units. So it is possible to create different set of units by defining different set of base units. These seven units are called base units because none of them can be expressed as combinations of the other six. This is identical to bricks and concrete being the base units of building. You can build different things using different combinations of bricks and concrete. The 26 letters of the alphabet are the base units for language like English. Many different words can be formed by using these letters. ,Physical quantity|Physics
5,5,2.2.2,The Other Systems of Units,10,The SI Units are not the only units available but they are most widely used. In Science there are three other sets of units that can also be used. These are mentioned here for interest only. c.g.s Units In the c.g.s. system the metre is replaced by the centimetre and the kilogram is replaced by the gram. This is simple change but it means that all units derived from these two are changed. For example the units of force and work are different. These units are used most often in astrophysics and atomic physics. Imperial Units Imperial units arose when kings and queens decided the measures that were to be used in the land. All the imperial base units except for the measure of time are different to those of SI units. This is the unit system you are most likely to encounter if SI units are not used. Examples of imperial units are pounds miles gallons and yards. These units are used by the Americans and British. As you can imagine having different units in use from place to place makes scientific communication very difficult. This was the motivation for adopting set of internationally agreed upon units. Natural Units This is the most sophisticated choice of units. Here the most fundamental discovered quantities (such as the speed of light) are set equal to 1. The argument for this choice is that all other quantities should be built from these fundamental units. This system of units is used in high energy physics and quantum mechanics. ,Light|Work (physics)|Speed|Force|Metre|Kilogram|Energy|Physics|Physics
6,6,2.3,Writing Units as Words or Symbols,10,Unit names are always written with lowercase first letter for example we write metre and litre. The symbols or abbreviations of units are also written with lowercase initials for example for metre and for litre. The exception to this rule is if the unit is named after person then the symbol is capital letter. For example the kelvin was named after Lord Kelvin and its symbol is K. If the abbreviation of the unit that is named after person has two letters the second letter is lowercase for example Hz for hertz. ,Hertz|Hertz|Metre|Metre
7,7,2.4,Combinations of SI Base Units,12,To make working with units easier some combinations of the base units are given special names but it is always correct to reduce everything to the base units. Table 2.2 lists some examples of combinations of SI base units that are assigned special names. Do not be concerned if the formulae look unfamiliar at this stage we will deal with each in detail in the chapters ahead (as well as many others) It is very important that you are able to recognise the units correctly. For instance the new- ton (N) is another name for the kilogram metre per second squared (kgms2) while the kilogram metre squared per second squared (kgm2 s2) is called the joule (J). Important: When writing combinations of base SI units place dot () between the units to indicate that different base units are used. For example the symbol for metres per second is correctly written as ms1 and not as ms1 or ms. ,Work (physics)|Metre|Metre|Metre|Joule|Kilogram|Kilogram
8,8,2.5,"Rounding, Scientific Notation and Significant Figures",12,,
9,9,2.5.1,Rounding Off,12,Certain numbers may take an infinite amount of paper and ink to write out. Not only is that impossible but writing numbers out to high accuracy (many decimal places) is very inconvenient and rarely gives better answers. For this reason we often estimate the number to certain number of decimal places. Rounding off or approximating decimal number to given number of decimal places is the quickest way to approximate number. For example if you wanted to round-off 26525272 to three decimal places then you would first count three places after the decimal. 2652|5272 All numbers to the right of are ignored after you determine whether the number in the third decimal place must be rounded up or rounded down. You round up the final digit (make the digit one more) if the first digit after the was greater or equal to and round down (leave the digit alone) otherwise. So since the first digit after the is we must round up the digit in the third decimal place to and the final answer of 26525272 rounded to three decimal places is 2653. ,
10,10,2.5.2,Error Margins,13,In calculation that has many steps it is best to leave the rounding off right until the end. For example Jack and Jill walks to school. They walk 09 kilometers to get to school and it takes them 17 minutes. We can calculate their speed in the following two ways. You will see that we get two different answers. In Method no rounding was done but in Method the time was rounded to decimal places. This made big difference to the answer. The answer in Method is more accurate because rounded numbers were not used in the calculation. Always only round off your final answer. ,Speed
11,11,2.5.3,Scientific Notation,13,In Science one often needs to work with very large or very small numbers. These can be written more easily in scientific notation in the general form 10e where is decimal number between and 10 that is rounded off to few decimal places. is known as the exponent and is an integer. If it represents how many times the decimal place in should be moved to the right. If then it represents how many times the decimal place in should be moved to the left. For example 324 103 represents 3240 (the decimal moved three places to the right) and 324 103 represents 000324 (the decimal moved three places to the left). If number must be converted into scientific notation we need to work out how many times the number must be multiplied or divided by 10 to make it into number between and 10 (i.e. the value of e) and what this number between and 10 is (the value of d). We do this by counting the number of decimal places the decimal comma must move. For example write the speed of light in scientific notation to two decimal places. The speed of light is 299 792 458 ms1. First find where the decimal comma must go for two decimal places (to find d) and then count how many places there are after the decimal comma to determine e. In this example the decimal comma must go after the first but since the number after the is 300. because there are digits left after the decimal comma. So the speed of light in scientific notation to two decimal places is 300 108 ms1. ,Light|Light|Light|Work (physics)|Work (physics)|Speed|Speed|Speed
12,12,2.5.4,Significant Figures,15,In number each non-zero digit is significant figure. Zeroes are only counted if they are between two non-zero digits or are at the end of the decimal part. For example the number 2000 has significant figure (the 2) but 20000 has significant figures. You estimate number like this by removing significant figures from the number (starting from the right) until you have the desired number of significant figures rounding as you go. For example 6827 has significant figures but if you wish to write it to significant figures it would mean removing the and rounding up so it would be 683. ,
13,13,2.6,Prefixes of Base Units,15,Now that you know how to write numbers in scientific notation another important aspect of units is the prefixes that are used with the units. Definition: Prefix prefix is group of letters that are placed in front of word. The effect of the prefix is to change meaning of the word. For example the prefix un is often added to word to mean not as in unnecessary which means not necessary. In the case of units the prefixes have special use. The kilogram (kg) is simple example. kg is equal to 000 or 103 g. Grouping the 103 and the together we can replace the 103 with the prefix (kilo). Therefore the takes the place of the 103. The kilogram is unique in that it is the only SI base unit containing prefix. In Science all the prefixes used with units are some power of 10. Table 2.4 lists some of these prefixes. You will not use most of these prefixes but those prefixes listed in bold should be learnt. The case of the prefix symbol is very important. Where letter features twice in the table it is written in uppercase for exponents bigger than one and in lowercase for exponents less than one. For example means mega (106) and means milli (103). ,Kilogram|Kilogram|Kilogram|Kilogram|Power (physics)
14,14,2.7,The Importance of Units,17,Without units much of our work as scientists would be meaningless. We need to express our thoughts clearly and units give meaning to the numbers we measure and calculate. Depending on which units we use the numbers are different. For example if you have 12 water it means nothing. You could have 12 ml of water 12 litres of water or even 12 bottles of water. Units are an essential part of the language we use. Units must be specified when expressing physical quantities. Imagine that you are baking cake but the units like grams and millilitres for the flour milk sugar and baking powder are not specified ,Work (physics)|Physical quantity|Physics
15,15,2.8,How to Change Units,17,It is very important that you are aware that different systems of units exist. Furthermore you must be able to convert between units. Being able to change between units (for example converting from millimetres to metres) is useful skill in Science. If you want to change millimetre to metre you divide by 1000 (follow the arrow from mm to m) or if you want to change kilometre to millimetre you multiply by 10001000. ,Metre|Metre
16,16,2.8.1,Two other useful conversions,19,Very often in Science you need to convert speed and temperature. The following two rules will help you do this: Converting speed When converting kmh1 to ms1you divide by 36. For example 72 kmh1 36 20 ms1. When converting ms1to kmh1 you multiply by 36. For example 30 ms136 108 kmh1. Converting temperature Converting between the kelvin and celsius temperature scales is easy. To convert from celsius to kelvin add 273. To convert from kelvin to celsius subtract 273. Representing the kelvin temperature by TK and the celsius temperature by ToC ,Speed|Speed|Temperature|Temperature|Temperature|Temperature|Temperature
17,17,2.9,A sanity test,19,sanity test is method of checking whether an answer makes sense. All we have to do is to take careful look at our answer and ask the question Does the answer make sense? Imagine you were calculating the number of people in classroom. If the answer you got was 000 000 people you would know it was wrong it is not possible to have that many people in classroom. That is all sanity test is is your answer insane or not? It is useful to have an idea of some numbers before we start. For example let us consider masses. An average person has mass around 70 kg while the heaviest person in medical history had mass of 635 kg. If you ever have to calculate persons mass and you get 000 kg this should fail your sanity check your answer is insane and you must have made mistake somewhere. In the same way an answer of 0.01 kg should fail your sanity test. The only problem with sanity check is that you must know what typical values for things are. For example finding the number of learners in classroom you need to know that there are usually 2050 people in classroom. If you get and answer of 2500 you should realise that it is wrong. ,Mass|Mass|Mass|Mass|Kilogram|Kilogram|Kilogram|Kilogram
18,18,3,Motion in One Dimension,23,,
19,19,3.1,Introduction,23,This chapter is about how things move in straight line or more scientifically how things move in one dimension. This is useful for learning how to describe the movement of cars along straight road or of trains along straight railway tracks. If you want to understand how any object moves for example car on the freeway soccer ball being kicked towards the goal or your dog chasing the neighbours cat then you have to understand three basic ideas about what it means when something is moving. These three ideas describe different parts of exactly how an object moves. They are: 1. position or displacement which tells us exactly where the object is 2. speed or velocity which tells us exactly how fast the objects position is changing or more familiarly how fast the object is moving and 3. acceleration which tells us exactly how fast the objects velocity is changing. You will also learn how to use position displacement speed velocity and acceleration to describe the motion of simple objects. You will learn how to read and draw graphs that summarise the motion of moving object. You will also learn about the equations that can be used to describe motion and how to apply these equations to objects moving in one dimension. ,Velocity|Velocity|Velocity|Speed|Speed|Position (vector)|Position (vector)|Position (vector)|Displacement (vector)|Displacement (vector)|Motion|Motion|Motion
20,20,3.2,"Reference Point, Frame of Reference and Position",23,The most important idea when studying motion is you have to know where you are. The word position describes your location (where you are). However saying that you are here is meaningless and you have to specify your position relative to known reference point. For example if you are from the doorway inside your classroom then your reference point is the doorway. This defines your position inside the classroom. Notice that you need reference point (the doorway) and direction (inside) to define your location. ,Position (vector)|Position (vector)|Position (vector)|Direction (geometry)|Motion
21,21,3.2.1,Frames of Reference,23,Definition: Frame of Reference frame of reference is reference point combined with set of directions. frame of reference is similar to the idea of reference point. frame of reference is defined as reference point combined with set of directions. For example boy is standing still inside train as it pulls out of station. You are standing on the platform watching the train move from left to right. To you it looks as if the boy is moving from left to right because relative to where you are standing (the platform) he is moving. According to the boy and his frame of reference (the train) he is not moving. frame of reference must have an origin (where you are standing on the platform) and at least positive direction. The train was moving from left to right making to your right positive and to your left negative. If someone else was looking at the same boy his frame of reference will be different. For example if he was standing on the other side of the platform the boy will be moving from right to left. ,Position (vector)|Position (vector)|Direction (geometry)|Direction (geometry)|Direction (geometry)|Frame of reference|Frame of reference|Frame of reference|Frame of reference|Frame of reference|Frame of reference|Frame of reference
22,22,3.2.2,Position,25,Definition: Position Position is measurement of location with reference to an origin. position is measurement of location with reference to an origin. Positions can therefore be negative or positive. The symbol is used to indicate position. has units of length for example cm or km. Figure 3.2.2 shows the position of school. Depending on what reference point we choose we can say that the school is 300 from Joans house (with Joans house as the reference point or origin) or 500 from Joels house (with Joels house as the reference point or origin). The shop is also 300 from Joans house but in the opposite direction as the school. When we choose reference point we have positive direction and negative direction. If we choose the direction towards the school as positive then the direction towards the shop is negative. negative direction is always opposite to the direction chosen as positive. ,Position (vector)|Position (vector)|Position (vector)|Position (vector)|Position (vector)|Position (vector)|Position (vector)|Position (vector)|Position (vector)|Position (vector)|Direction (geometry)|Direction (geometry)|Direction (geometry)|Direction (geometry)|Direction (geometry)|Direction (geometry)|Direction (geometry)|Length
23,23,3.3,Displacement and Distance,28,Definition: Displacement Displacement is the change in an objects position. The displacement of an object is defined as its change in position (final position minus initial position). Displacement has magnitude and direction and is therefore vector. For example if the initial position of car is xi and it moves to final position of xf then the displacement is: However subtracting an initial quantity from final quantity happens often in Physics so we use the shortcut to mean final initial. Therefore displacement can be written: Important: The words initial and final will be used very often in Physics. Initial will always refer to something that happened earlier in time and final will always refer to something that happened later in time. It will often happen that the final value is smaller than the initial value such that the difference is negative. This is ok Displacement does not depend on the path travelled but only on the initial and final positions (Figure 3.4). We use the word distance to describe how far an object travels along particular path. Distance is the actual distance that was covered. Distance (symbol d) does not have direction so it is scalar. Displacement is the shortest distance from the starting point to the endpoint from the school to the shop in the figure. Displacement has direction and is therefore vector. Figure 3.2.2 shows the five houses we discussed earlier. Jack walks to school but instead of walking straight to school he decided to walk to his friend Joels house first to fetch him so that they can walk to school together. Jack covers distance of 400 to Joels house and another 500 to school. He covers distance of 900 m. His displacement however is only 100 towards the school. This is because displacement only looks at the starting position (his house) and the end position (the school). It does not depend on the path he travelled. To calculate his distance and displacement we need to choose reference point and direction. Lets choose Jacks house as the reference point and towards Joels house as the positive direc- tion (which means that towards the school is negative). We would do the calculations as follows: It is possible to have displacement of and distance that is not m. This happens when an object completes round trip back to its original position like an athlete running around track. ,Position (vector)|Position (vector)|Position (vector)|Position (vector)|Position (vector)|Position (vector)|Position (vector)|Position (vector)|Position (vector)|Position (vector)|Position (vector)|Distance|Distance|Distance|Distance|Distance|Distance|Distance|Distance|Distance|Displacement (vector)|Displacement (vector)|Displacement (vector)|Displacement (vector)|Displacement (vector)|Displacement (vector)|Displacement (vector)|Displacement (vector)|Displacement (vector)|Displacement (vector)|Displacement (vector)|Displacement (vector)|Displacement (vector)|Direction (geometry)|Direction (geometry)|Direction (geometry)|Direction (geometry)|Scalar (mathematics)|Euclidean vector|Euclidean vector|Physics|Physics
24,24,3.3.1,Interpreting Direction,29,Very often in calculations you will get negative answer. For example Jacks displacement in the example above is calculated as -100 m. The minus sign in front of the answer means that his displacement is 100 in the opposite direction (opposite to the direction chosen as positive in the beginning of the question). When we start calculation we choose frame of reference and positive direction. In the first example above the reference point is Jacks house and the positive direction is towards Joels house. Therefore Jacks displacement is 100 towards the school. Notice that distance has no direction but displacement has. ,Position (vector)|Position (vector)|Position (vector)|Distance|Displacement (vector)|Displacement (vector)|Displacement (vector)|Displacement (vector)|Direction (geometry)|Direction (geometry)|Direction (geometry)|Direction (geometry)|Direction (geometry)|Frame of reference
25,25,3.3.2,Differences between Distance and Displacement,29,Definition: Vectors and Scalars vector is physical quantity with magnitude (size) and direction. scalar is physical quantity with magnitude (size) only. ,Physical quantity|Physical quantity|Direction (geometry)|Scalar (mathematics)|Scalar (mathematics)|Euclidean vector|Euclidean vector|Physics|Physics
