,Unnamed: 0,section,title,page_no,content,tagged_content
340,340,25.2.1,Dispersion of white light,544,White light like the light which comes from the sun is made up of all the visible wavelengths of light. In other words white light is combination of all the colours of visible light. In Chapter you learnt that the speed of light is different in different substances. The speed of light in different substances depends on the frequency of the light. For example when white light travels through glass light of the different frequencies is slowed down by different amounts. The lower the frequency the less the speed is reduced which means that red light (lowest frequency) is slowed down less than violet light (highest frequency). We can see this when white light is incident on glass prism. Have look at the picture below. When the white light hits the edge of the prism the light which travels through the glass is refracted as it moves from the less dense medium (air) to the more dense medium (glass). The red light which is slowed down the least is refracted the least. The violet light which is slowed down the most is refracted the most. When the light hits the other side of the prism it is again refracted but the angle of the prism edge allows the light to remain separated into its different colours. White light is therefore separated into its different colours by the prism and we say that the white light has been dispersed by the prism. The dispersion effect is also responsible for why we see rainbows. When sunlight hits drops of water in the atmosphere the white light is dispersed into its different colours by the water. ,Refraction|Refraction|Refraction|Refraction|Wavelength|Light|Light|Light|Light|Light|Light|Light|Light|Light|Light|Light|Light|Light|Light|Light|Light|Light|Light|Light|Light|Light|Light|Frequency|Frequency|Frequency|Frequency|Frequency|Speed|Speed|Speed|Color|Color|Color|Color|Refractive index|Refractive index|Refractive index|Refractive index
341,341,25.3,Addition and Subtraction of Light,544,,
342,342,25.3.1,Additive Primary Colours,544,The primary colours of light are red green and blue. When all the primary colours are superposed (added together) white light is produced. Red green and blue are therefore called the additive primary colours. All the other colours can be produced by different combinations of red green and blue. ,Light|Light|Color|Color|Color|Color
343,343,25.3.2,Subtractive Primary Colours,545,The subtractive primary colours are obtained by subtracting one of the three additive primary colours from white light. The subtractive primary colours are yellow magenta and cyan. Magenta appears as pinkish-purplish colour and cyan looks greenish-blue. You can see how the primary colours of light add up to the different subtractive colours in the illustration below. ,Light|Light|Color|Color|Color|Color|Color|Color|Subtractive color
344,344,25.3.3,Complementary Colours,546,Complementary colours are two colours of light which add together to give white. You should have found that the complementary colours for red green and blue are: Red and Cyan Green and Magenta Blue and Yellow ,Light|Color|Color|Color
345,345,25.3.4,Perception of Colour,546,The light-sensitive lining on the back inside half of the human eye is called the retina. The retina contains two kinds of light sensitive cells or photoreceptors: the rod cells (sensitive to low light) and the cone cells (sensitive to normal daylight) which enable us to see. The rods are not very sensitive to colour but work well in dimly lit conditions. This is why it is possible to see in dark room but it is hard to see any colours. Only your rods are sensitive to the low light levels and so you can only see in black white and grey. The cones enable us to see colours. Normally there are three kinds of cones each containing different pigment. The cones are activated when the pigments absorb light. The three types of cones are sensitive to (i.e. absorb) red blue and green light respectively. Therefore we can perceive all the different colours in the visible spectrum when the different types of cones are stimulated by different amounts since they are just combinations of the three primary colours of light. The rods and cones have different response times to light. The cones react quickly when bright light falls on them. The rods take longer time to react. This is why it takes while (about 10 minutes) for your eyes to adjust when you enter dark room after being outside on sunny day. Color blindness in humans is the inability to perceive differences between some or all colors that other people can see. Most often it is genetic problem but may also occur because of eye nerve or brain damage or due to exposure to certain chemicals. The most common forms of human color blindness result from problems with either the middle or long wavelength sensitive cone systems and involve difficulties in discriminating reds yellows and greens from one another. This is called red-green color blindness. Other forms of color blindness are much rarer. They include problems in discriminating blues from yellows and the rarest forms of all complete color blindness or monochromasy where one cannot distinguish any color from grey as in black-and-white movie or photograph. ,Wavelength|Light|Light|Light|Light|Light|Light|Light|Light|Work (physics)|Hardness|Color|Color|Color|Color|Color|Color|Color|Color|Color|Color|Color|Color|Pigment|Pigment
346,346,25.3.5,Colours on a Television Screen,547,If you look very closely at colour cathode-ray television screen or computer screen you will see that there are very many small red green and blue dots called phosphors on it. These dots are caused to fluoresce (glow brightly) when beam of electrons from the cathode-ray tube behind the screen hits them. Since different combinations of the three primary colours of light can produce any other colour only red green and blue dots are needed to make pictures containing all the colours of the visible spectrum. ,Light|Color|Color|Color|Color|Electron
347,347,25.4,Pigments and Paints,548,We have learnt that white light is combination of all the colours of the visible spectrum and that each colour of light is related to different frequency. But what gives everyday objects around us their different colours? Pigments are substances which give an object its colour by absorbing certain frequencies of light and reflecting other frequencies. For example red pigment absorbs all colours of light except red which it reflects. Paints and inks contain pigments which gives the paints and inks different colours. ,Light|Light|Light|Light|Frequency|Frequency|Frequency|Color|Color|Color|Color|Color|Color|Pigment|Pigment|Pigment|Reflection (physics)|Reflection (physics)
348,348,25.4.1,Colour of opaque objects,548,Objects which you cannot see through (i.e. they are not transparent) are called opaque. Examples of some opaque objects are metals wood and bricks. The colour of an opaque object is determined by the colours (therefore frequencies) of light which it reflects. For example when white light strikes blue opaque object such as ruler the ruler will absorb all frequencies of light except blue which will be reflected. The reflected blue light is the light which makes it into our eyes and therefore the object will appear blue. Opaque objects which appear white do not absorb any light. They reflect all the frequencies. Black opaque objects absorb all frequencies of light. They do not reflect at all and therefore appear to have no colour. ,Light|Light|Light|Light|Light|Light|Light|Frequency|Frequency|Frequency|Frequency|Color|Color|Color|Reflection (physics)|Reflection (physics)|Reflection (physics)|Reflection (physics)|Reflection (physics)
349,349,25.4.2,Colour of transparent objects,548,If an object is transparent it means that you can see through it. For example glass clean water and some clear plastics are transparent. The colour of transparent object is determined by the colours (frequencies) of light which it transmits (allows to pass through it). For example cup made of green glass will appear green because it absorbs all the other frequencies of light except green which it transmits. This is the light which we receive in our eyes and the object appears green. ,Plasticity (physics)|Light|Light|Light|Frequency|Frequency|Color|Color
350,350,25.4.3,Pigment primary colours,549,The primary pigments and paints are cyan magenta and yellow. When pigments or paints of these three colours are mixed together in equal amounts they produce black. Any other colour of paint can be made by mixing the primary pigments together in different quantities. The primary pigments are related to the primary colours of light in the following way: Colour printers only use colours of ink: cyan magenta yellow and black. All the other colours can be mixed from these ,Light|Color|Color|Color|Color|Color|Color|Pigment|Pigment|Pigment|Pigment
351,351,26,2D and 3D Wavefronts,553,,
352,352,26.1,Introduction,553,You have learnt about the basic principles of reflection and refraction. In this chapter you will learn about phenomena that arise with waves in two and three dimensions: interference and diffraction. ,Refraction|Diffraction|Wave|Refractive index|Reflection (physics)
353,353,26.2,Wavefronts,553,Consider three point sources of waves. If each source emits waves isotropically (i.e. the same in all directions) we will get the situation shown in as shown in Figure 26.1. We define wavefront as the imaginary line that joins waves that are in phase. These are indicated by the grey vertical lines in Figure 26.1. The points that are in phase can be peaks troughs or anything in between it doesnt matter which points you choose as long as they are in phase. Figure 26.1: Wavefronts are imaginary lines joining waves that are in phase. In the example the wavefronts (shown by the grey vertical lines) join all waves at the crest of their cycle. ,Wave|Wave|Wave|Wave|Wave|Direction (geometry)|Crest (physics)|Crest (physics)
354,354,26.3,The Huygens Principle,554,Christiaan Huygens described how to determine the path of waves through medium. Definition: The Huygens Principle Each point on wavefront acts like point source of circular waves. The waves emitted from these point sources interfere to form another wavefront. simple example of the Huygens Principle is to consider the single wavefront in Figure 26.2. Christiaan Huygens (14 April 1629 July 1695) was Dutch mathematician astronomer and physicist born in The Hague as the son of Constantijn Huygens. He studied law at the University of Leiden and the College of Orange in Breda before turning to science. Historians commonly associate Huygens with the scientific revolution. Huygens generally receives minor credit for his role in the development of modern calculus. He also achieved note for his arguments that light consisted of waves see: wave-particle duality. In 1655 he discovered Saturns moon Titan. He also examined Saturns planetary rings and in 1656 he discovered that those rings consisted of rocks. In the same year he observed and sketched the Orion Nebula. He also discovered several interstellar nebulae and some double stars. ,Light|Wave|Wave|Wave|Wave|HuygensFresnel principle|HuygensFresnel principle
355,355,26.4,Interference,556,Interference occurs when two identical waves pass through the same region of space at the same time resulting in superposition of waves. There are two types of interference which is of interest: constructive interference and destructive interference. Constructive interference occurs when both waves have displacement in the same direction while destructive interference occurs when one wave has displacement in the opposite direction to the other thereby resulting in cancellation. There is no displacement of the medium in destructive interference while for constructive interference the displacement of the medium is greater than the individual displacements. Constructive interference occurs when both waves have displacement in the same direction this means they both have peak or they both have trough at the same place at the same time. If they both have peak then the peaks add together to form bigger peak. If they both have trough then the trough gets deeper. Destructive interference occurs when one wave has displacement in the opposite direction to the other this means that the one wave has peak and the other wave has trough. If the waves have identical magnitudes then the peak fills up the trough and the medium will look like there are no waves at that point. There will be no displacement of the medium. place where destructive interference takes places is called node. Waves can interfere at places where there is never trough and trough or peak and peak or trough and peak at the same time. At these places the waves will add together and the resultant displacement will be the sum of the two waves but they wont be points of maximum interference. Consider the two identical waves shown in the picture below. The wavefronts of the peaks are shown as black lines while the wavefronts of the troughs are shown as grey lines. You can see that the black lines cross other black lines in many places. This means two peaks are in the same place at the same time so we will have constructive interference where the two peaks add together to form bigger peak. Two points sources (A and B) radiate identical waves. The wavefronts of the peaks (black lines) and troughs (grey lines) are shown. Constructive interference occurs where two black lines intersect or where two gray lines intersect. Destructive interference occurs where black line intersects with grey line. You can see that the black lines cross other black lines in many places. This means two peaks are in the same place at the same time so we will have constructive interference where the two peaks add together to form bigger peak. When the grey lines cross other grey lines there are two troughs are in the same place at the same time so we will have constructive interference where the two troughs add together to form bigger trough. In the case where grey line crosses black line we are seeing trough and peak in the same place. These will cancel each other out and the medium will have no displacement at that point. black line black line peak peak constructive interference grey line grey line trough trough constructive interference black line grey line grey line black line peak trough trough peak destructive interference On half the picture below we have marked the constructive interference with solid black diamond and the destructive interference with hollow diamond. To see if you understand it cover up the half we have marked with diamonds and try to work out which points are constructive and destructive on the other half of the picture. The two halves are mirror images of each other so you can check yourself. ,Work (physics)|Wave|Wave|Wave|Wave|Wave|Wave|Wave|Wave|Wave|Wave|Wave|Wave|Wave|Wave|Wave|Displacement (vector)|Displacement (vector)|Displacement (vector)|Displacement (vector)|Displacement (vector)|Displacement (vector)|Displacement (vector)|Displacement (vector)|Displacement (vector)|Displacement (vector)|Mirror image|Direction (geometry)|Direction (geometry)|Direction (geometry)|Direction (geometry)|Crest (physics)|Crest (physics)|Crest (physics)|Crest (physics)|Crest (physics)|Crest (physics)|Crest (physics)|Crest (physics)|Crest (physics)|Crest (physics)|Crest (physics)|Crest (physics)|Crest (physics)|Crest (physics)|Crest (physics)|Crest (physics)|Crest (physics)|Crest (physics)
356,356,26.5,Diffraction,557,One of the most interesting and also very useful properties of waves is diffraction. Definition: Diffraction Diffraction is the ability of wave to spread out in wavefronts as the wave passes through small aperture or around sharp edge. Extension: Diffraction Diffraction refers to various phenomena associated with wave propagation such as the bending spreading and interference of waves emerging from an aperture. It occurs with any type of wave including sound waves water waves electromagnetic waves such as light and radio waves. While diffraction always occurs its effects are generally only noticeable for waves where the wavelength is on the order of the feature size of the diffracting objects or apertures. For example if two rooms are connected by an open doorway and sound is produced in remote corner of one of them person in the other room will hear the sound as if it originated at the doorway. As far as the second room is concerned the vibrating air in the doorway is the source of the sound. The same is true of light passing the edge of an obstacle but this is not as easily observed because of the short wavelength of visible light. This means that when waves move through small holes they appear to bend around the sides because there are not enough points on the wavefront to form another straight wavefront. This is bending round the sides we call diffraction. Extension: Diffraction Diffraction effects are more clear for water waves with longer wavelengths. Diffraction can be demonstrated by placing small barriers and obstacles in ripple tank and observing the path of the water waves as they encounter the obstacles. The waves are seen to pass around the barrier into the regions behind it subsequently the water behind the barrier is disturbed. The amount of diffraction (the sharpness of the bending) increases with increasing wavelength and decreases with decreasing wavelength. In fact when the wavelength of the waves are smaller than the obstacle no noticeable diffraction occurs. ,Wavelength|Wavelength|Wavelength|Wavelength|Wavelength|Wavelength|Light|Light|Light|Diffraction|Diffraction|Diffraction|Diffraction|Diffraction|Diffraction|Diffraction|Diffraction|Diffraction|Diffraction|Diffraction|Diffraction|Diffraction|Sound|Sound|Sound|Sound|Wave|Wave|Wave|Wave|Wave|Wave|Wave|Wave|Wave|Wave|Wave|Wave|Wave|Wave|Wave|Wave
357,357,26.5.1,Diffraction through a Slit,558,When wave strikes barrier with hole only part of the wave can move through the hole. If the hole is similar in size to the wavelength of the wave diffractions occurs. The waves that comes through the hole no longer looks like straight wave front. It bends around the edges of the hole. If the hole is small enough it acts like point source of circular waves. Now if allow the wavefront to impinge on barrier with hole in it then only the points on the wavefront that move into the hole can continue emitting forward moving waves but because lot of the wavefront have been removed the points on the edges of the hole emit waves that bend round the edges. If you employ Huygens principle you can see the effect is that the wavefronts are no longer straight lines. Each point of the slit acts like point source. If we think about the two point sources on the edges of the slit and call them and then we can go back to the diagram we had earlier but with some parts block by the wall. If this diagram were showing sound waves then the sound would be louder (constructive interference) in some places and quieter (destructive interference) in others. You can start to see that there will be pattern (interference pattern) to the louder and quieter places. If we were studying light waves then the light would be brighter in some places than others depending on the interferences. The intensity (how bright or loud) of the interference pattern for single narrow slit looks like this: The picture above shows how the waves add together to form the interference pattern. The peaks correspond to places where the waves are adding most intensely and the zeroes are places where destructive interference is taking place. When looking at interference patterns from light the spectrum looks like: There is formula we can use to determine where the peaks and minimums are in the interference spectrum. There will be more than one minimum. There are the same number of minima on either side of the central peak and the distances from the first one on each side are the same to the peak. The distances to the peak from the second minimum on each side is also the same in fact the two sides are mirror images of each other. We label the first minimum that corresponds to positive angle from the centre as and the first on the other side (a negative angle from the centre as the second set of minima are labelled and etc. The equation for the angle at which the minima occur is Definition: Interference Minima The angle at which the minima in the interference spectrum occur is: sin where is the angle to the minimum is the wavelength of the impinging wavefronts is the order of the mimimum 123 ... From the formula you can see that smaller wavelength for the same slit results in smaller angle to the interference minimum. This is something you just saw in the two worked examples. Do sanity check go back and see if the answer makes sense. Ask yourself which light had the longer wavelength which light had the larger angle and what do you expect for longer wavelengths from the formula. ,Wavelength|Wavelength|Wavelength|Wavelength|Wavelength|Light|Light|Light|Light|Light|Work (physics)|Diffraction|Sound|Sound|Wave|Wave|Wave|Wave|Wave|Wave|Wave|Wave|Wave|Wave|Wave|Wave|Position (vector)|HuygensFresnel principle|Distance|Distance|Mirror image
358,358,26.6,Shock Waves and Sonic Booms,562,Now we know that the waves move away from the source at the speed of sound. What happens if the source moves at the same time as emitting sounds? Once sound wave has been emitted it is no longer connected to the source so if the source moves it doesnt change the way the sound wave is propagating through the medium. This means source can actually catch up with sound waves it has emitted. The speed of sound is very fast in air about 340 s1 so if we want to talk about source catching up to sound waves then the source has to be able to move very fast. good source of sound waves to discuss is jet aircraft. Fighter jets can move very fast and they are very noisy so they are good source of sound for our discussion. Here are the speeds for selection of aircraft that can fly faster than the speed of sound. ,Speed|Speed|Speed|Speed|Sound|Sound|Sound|Sound|Sound|Sound|Sound|Sound|Sound|Sound|Wave|Wave|Wave|Wave|Wave|Wave
359,359,26.6.1,Subsonic Flight,563,Definition: Subsonic Subsonic refers to speeds slower than the speed of sound. When source emits sound waves and is moving but slower than the speed of sound you get the situation in this picture. Notice that the source moving means that the wavefronts and therefore peaks in the wave are actually closer together in the one direction and further apart in the other. subsonic flight If you measure the waves on the side where the peaks are closer together youll measure different wavelength than on the other side of the source. This means that the noise from the source will sound different on the different sides. This is called the Doppler Effect. Definition: Doppler Effect when the wavelength and frequency measured by an observer are different to those emitted by the source due to movement of the source or observer. ,Wavelength|Wavelength|Frequency|Speed|Speed|Speed|Sound|Sound|Sound|Sound|Doppler effect|Doppler effect|Wave|Wave|Wave|Direction (geometry)
360,360,26.6.2,Supersonic Flight,563,Definition: Supersonic Supersonic refers to speeds faster than the speed of sound. If plane flies at exactly the speed of sound then the waves that it emits in the direction it is flying wont be able to get away from the plane. It also means that the next sound wave emitted will be exactly on top of the previous one look at this picture to see what the wavefronts would look like: Sometimes we use the speed of sound as reference to describe the speed of the object (aircraft in our discussion). Definition: Mach Number The Mach Number is the ratio of the speed of an object to the speed of sound in the surrounding medium. Mach number is tells you how many times faster than sound the aircraft is moving. Mach Number aircraft moving slower than the speed of sound Mach Number aircraft moving at the speed of sound Mach Number aircraft moving faster than the speed of sound To work out the Mach Number divide the speed of the aircraft by the speed of sound. Mach Number vaircraft vsound Remember: the units must be the same before you divide. If the aircraft is moving faster than the speed of sound then the wavefronts look like this: If the source moves faster than the speed of sound cone of wave fronts is created. This is called Mach cone. From constructive interference we know that two peaks that add together form larger peak. In Mach cone many many peaks add together to form very large peak this is sound wave so the large peak is very very loud sound wave. This sounds like huge boom and we call the noise sonic boom. Definition: Sonic Boom sonic boom is the sound heard by an observer as shockwave passes. ,Sonic boom|Sonic boom|Sonic boom|Work (physics)|Speed|Speed|Speed|Speed|Speed|Speed|Speed|Speed|Speed|Speed|Speed|Speed|Speed|Speed|Sound|Sound|Sound|Sound|Sound|Sound|Sound|Sound|Sound|Sound|Sound|Sound|Sound|Sound|Sound|Sound|Wave|Wave|Wave|Wave|Wave|Direction (geometry)
