,Unnamed: 0,section,title,page_no,content,tagged_content
24,24,3.4,Real Zeros of Polynomials,253,"Rational Zeros of Polynomials Descartes Rule of Signs and Upper and Lower Bounds for Roots Using Algebra and Graphing Devices to Solve Polynomial Equations The Factor Theorem tells us that finding the zeros of polynomial is really the same thing as factoring it into linear factors. In this section we study some algebraic methods that help us to find the real zeros of polynomial and thereby factor the polynomial. We be- gin with the rational zeros of polynomial. Rational Zeros of Polynomials To help us understand the next theorem lets consider the polynomial P1x2 1x 22 1x 32 1x 42 14x 24 Factored form Expanded form From the factored form we see that the zeros of are and ""4. When the polynomial is expanded the constant 24 is obtained by multiplying 1""22 1""32 This means that the zeros of the polynomial are all factors of the constant term. The following gener- alizes this observation. RATIONAL ZEROS THEOREM If the polynomial P1x2 n""1 n""1 has integer coefficients then every rational zero of is of the form where and PROOF is factor of the constant coefficient is factor of the leading coefficient FINDING THE RATIONAL ZEROS OF POLYNOMIAL 1. List Possible Zeros. Theorem. List all possible rational zeros using the Rational Zeros 2. Divide. Use synthetic division to evaluate the polynomial at each of the can- didates for the rational zeros that you found in Step 1. When the remainder is note the quotient you have obtained. 3. Repeat. Repeat Steps and for the quotient. Stop when you reach quo- tient that is quadratic or factors easily and use the quadratic formula or factor to find the remaining zeros. Descartes Rule of Signs and Upper and Lower Bounds for Roots Polynomial Variations in sign 4x 2x 3x In some cases the following rulediscovered by the French philosopher and mathemati- cian Ren Descartes around 1637 (see page 181)is helpful in eliminating candidates from lengthy lists of possible rational roots. To describe this rule we need the concept of variation in sign. If P1x2 is polynomial with real coefficients written with descending powers of (and omitting powers with coefficient 0) then variation in sign occurs whenever adjacent coefficients have opposite signs. For example P1x2 5x 3x 2x has three variations in sign. DESCARTES RULE OF SIGNS Let be polynomial with real coefficients. 1. The number of positive real zeros of P1x2 either is equal to the number of vari- ations in sign in P1x2 or is less than that by an even whole number. 2. The number of negative real zeros of P1x2 either is equal to the number of variations in sign in P1""x or is less than that by an even whole number. THE UPPER AND LOWER BOUNDS THEOREM Let be polynomial with real coefficients. 1. If we divide P1x2 by (with 0) using synthetic division and if the row that contains the quotient and remainder has no negative entry then is an upper bound for the real zeros of P. 2. If we divide P1x2 by (with 0) using synthetic division and if the row that contains the quotient and remainder has entries that are alternately nonpos- itive and nonnegative then is lower bound for the real zeros of P. proof of this theorem is suggested in Exercise 97. The phrase alternately nonposi- tive and nonnegative simply means that the signs of the numbers alternate with con- sidered to be positive or negative as required. Using Algebra and Graphing Devices to Solve Polynomial Equations In Section 1.9 we used graphing devices to solve equations graphically. We can now use the algebraic techniques that weve learned to select an appropriate viewing rectangle when solving polynomial equation graphically. ",Graph of a function|Graph of a function|Graph of a function|Rectangle|Inequality (mathematics)|Inequality (mathematics)|Algebraic equation|Algebraic equation|Algebraic equation|Algebra|Algebra|Algebra|Algebra|Mathematical proof|Mathematical proof|Natural number|Natural number|Graph (mathematics)|Graph (mathematics)|Graph (mathematics)|Division (mathematics)|Division (mathematics)|Division (mathematics)|Zero of a function|Zero of a function|Zero of a function|Zero of a function|Zero of a function|Polynomial|Polynomial|Polynomial|Polynomial|Polynomial|Polynomial|Polynomial|Polynomial|Polynomial|Polynomial|Polynomial|Polynomial|Polynomial|Polynomial|Polynomial|Polynomial|Polynomial|Polynomial|Polynomial|Sign (mathematics)|Sign (mathematics)|Sign (mathematics)|Sign (mathematics)|Sign (mathematics)|Sign (mathematics)|Sign (mathematics)|Sign (mathematics)|Sign (mathematics)|Sign (mathematics)|Sign (mathematics)|Sign (mathematics)|Sign (mathematics)|Sign (mathematics)|Sign (mathematics)|Sign (mathematics)|Sign (mathematics)|Sign (mathematics)|Equation|Equation|Equation|Equation|Zero (complex analysis)|Zero (complex analysis)|Zero (complex analysis)|Zero (complex analysis)|Zero (complex analysis)|Zero (complex analysis)|Zero (complex analysis)|Zero (complex analysis)|Zero (complex analysis)|Zero (complex analysis)|Zero (complex analysis)|Zero (complex analysis)|Zero (complex analysis)|Zero (complex analysis)|Zero (complex analysis)|Zero (complex analysis)|Zero (complex analysis)|Zero (complex analysis)|Zero (complex analysis)|Universal quantification|Universal quantification|Descartes' rule of signs|Descartes' rule of signs|Descartes' rule of signs|Rationalisation (mathematics)|Rationalisation (mathematics)|Rationalisation (mathematics)|Rationalisation (mathematics)|Rationalisation (mathematics)|Rationalisation (mathematics)|Rationalisation (mathematics)|Rationalisation (mathematics)|Rationalisation (mathematics)|Rationalisation (mathematics)|Nth root|Nth root|Nth root|Position (vector)|Position (vector)|Equation solving|Number|Number|Number|Number|Number|Number|Number|Multiplication|Arithmetic mean|Arithmetic mean|Quadratic formula|Equality (mathematics)|Equality (mathematics)|Formula|Real number|Real number|Real number|Real number|Real number|Real number|Real number|Real number|Integer|Rational root theorem|Linear function|Exponentiation|Exponentiation|Factorization|Factorization|Factorization|Factorization|Factorization|Factorization|Factorization|Factorization|Factorization|Factorization|Factorization|Homogeneous polynomial|Homogeneous polynomial|Homogeneous polynomial|Homogeneous polynomial|Equality|Equality
25,25,3.5,Complex Numbers,264,"Arithmetic Operations on Complex Numbers Square Roots of Negative Numbers Complex Solutions of Quadratic Equations In Section 1.5 we saw that if the discriminant of quadratic equation is negative the equa- tion has no real solution. For example the equation has no real solution. If we try to solve this equation we get ""4 so 1""4 See the note on Cardano (page 274) for an example of how complex numbers are used to find real solutions of poly- nomial equations. But this is impossible since the square of any real number is positive. For example 1""22 positive number. Thus negative numbers dont have real square roots. To make it possible to solve all quadratic equations mathematicians invented an ex- panded number system called the complex number system. First they defined the new number 1""1 This means that ""1. complex number is then number of the form bi where and are real numbers. DEFINITION OF COMPLEX NUMBERS complex number is an expression of the form bi where and are real numbers and ""1. The real part of this complex number is and the imaginary part is b. Two complex numbers are equal if and only if their real parts are equal and their imaginary parts are equal. Note that both the real and imaginary parts of complex number are real numbers. Arithmetic Operations on Complex Numbers Complex numbers are added subtracted multiplied and divided just as we would any number of the form 1c The only difference that we need to keep in mind is that ""1. Thus the following calculations are valid. 1a bi2 1c di ac 1ad bc2i bdi ac 1ad bc2i bd1""12 1ac bd2 1ad bc2i Multiply and collect like terms ""1 Combine real and imaginary parts We therefore define the sum difference and product of complex numbers as follows. ADDING SUBTRACTING AND MULTIPLYING COMPLEX NUMBERS Definition Description Addition 1a bi2 1c di2 1a c2 1b d2i To add complex numbers add the real parts and the imaginary parts. Subtraction 1a bi2 1c di2 1a c2 1b d2i To subtract complex numbers subtract the real parts and the imaginary parts. Multiplication 1a bi2 1c di2 1ac bd2 1ad bc 2i EXAMPLE Graphing calculators can perform arith- metic operations on complex numbers. (3+5i)+(4-2i) 7+3i (3+5i)*(4-2i) 22+14i Multiply complex numbers like binomials using ""1. Complex Solutions of Quadratic Equations We have already seen that if then the solutions of the quadratic equation ax bx are ""b 2b 4ac 2a If 4ac then the equation has no real solution. But in the complex number sys- tem this equation will always have solutions because negative numbers have square roots in this expanded setting. ",Graph of a function|Mereology|Mereology|Mereology|Mereology|Mereology|Mereology|Mereology|Mereology|Mereology|Mereology|Subtraction|Subtraction|Subtraction|Subtraction|Subtraction|Subtraction|Subtraction|Continuous function|Continuous function|Continuous function|Continuous function|Continuous function|Continuous function|Continuous function|Product topology|Imaginary number|Binomial|Square (algebra)|Square (algebra)|Square (algebra)|Square (algebra)|Sum|Summation|Graph (mathematics)|Division (mathematics)|System of linear equations|Negative number|Negative number|Negative number|Operation (mathematics)|Operation (mathematics)|Operation (mathematics)|Set (mathematics)|Sign (mathematics)|Sign (mathematics)|Sign (mathematics)|Sign (mathematics)|Sign (mathematics)|Sign (mathematics)|Equation|Equation|Equation|Equation|Equation|Equation|Equation|Equation|Equation|Equation|Universal quantification|Exponential function|Square root|Square root|Square root|Nth root|Nth root|Nth root|Product (mathematics)|Position (vector)|Position (vector)|Number|Number|Number|Number|Number|Number|Number|Number|Number|Number|Number|Number|Number|Number|Number|Number|Number|Number|Number|Number|Number|Number|Number|Number|Number|Number|Number|Number|Number|Number|Multiplication|Multiplication|Multiplication|Multiplication|Multiplication|Multiplication|Addition|Addition|Addition|Arithmetic mean|Quadratic equation|Quadratic equation|Quadratic equation|Quadratic equation|Quadratic equation|Complex number|Complex number|Complex number|Complex number|Complex number|Complex number|Complex number|Complex number|Complex number|Complex number|Complex number|Complex number|Complex number|Complex number|Complex number|Complex number|Complex number|Complex number|Complex number|Complex number|Complex number|Complex number|Complex number|Complex number|Complex number|Complex number|Complex number|Complex number|Matrix (mathematics)|Matrix (mathematics)|Matrix (mathematics)|Matrix (mathematics)|Derivative|Derivative|Equality (mathematics)|Equality (mathematics)|Equality (mathematics)|Real number|Real number|Real number|Real number|Real number|Real number|Real number|Real number|Real number|Real number|Real number|Real number|Real number|Real number|Real number|Expression (mathematics)|Empty sum|Arithmetic|Arithmetic|Homogeneous polynomial|Homogeneous polynomial|Homogeneous polynomial|Equality|Equality|Equality
26,26,3.6,Complex Zeros and the Fundamental Theorem of Algebra,269,"The Fundamental Theorem of Algebra and Complete Factorization Zeros and Their Multiplicities Complex Zeros Come in Conjugate Pairs Linear and Quadratic Factors We have already seen that an nth-degree polynomial can have at most real zeros. In the complex number system an nth-degree polynomial has exactly zeros and so can be fac- tored into exactly linear factors. This fact is consequence of the Fundamental Theorem of Algebra which was proved by the German mathematician C. F. Gauss in 1799 (see page 272). The Fundamental Theorem of Algebra and Complete Factorization The following theorem is the basis for much of our work in factoring polynomials and solving polynomial equations. FUNDAMENTAL THEOREM OF ALGEBRA Every polynomial P1x2 n""1 n""1 with complex coefficients has at least one complex zero. 1n 02 Because any real number is also complex number the theorem applies to polynomi- als with real coefficients as well. The Fundamental Theorem of Algebra and the Factor Theorem together show that polynomial can be factored completely into linear factors as we now prove. COMPLETE FACTORIZATION THEOREM If P1x is polynomial of degree then there exist complex numbers (with 0) such that Zeros and Their Multiplicities In the Complete Factorization Theorem the numbers are the zeros of P. These zeros need not all be different. If the factor appears times in the complete factorization of P1x2 then we say that is zero of multiplicity (see page 240). For ex- ample the polynomial has the following zeros: P1x 1x 12 1x 22 1x 32 1multiplicity 32 ""2 1multiplicity 22 ""3 1multiplicity 52 The polynomial has the same number of zeros as its degree: It has degree 10 and has 10 zeros provided that we count multiplicities. This is true for all polynomials as we prove in the following theorem. ZEROS THEOREM Every polynomial of degree has exactly zeros provided that zero of multiplicity is counted times. Complex Zeros Come in Conjugate Pairs As you might have noticed from the examples so far the complex zeros of polynomials with real coefficients come in pairs. Whenever bi is zero its complex conjugate bi is also zero. CONJUGATE ZEROS THEOREM If the polynomial has real coefficients and if the complex number is zero of then its complex conjugate is also zero of P. Linear and Quadratic Factors We have seen that polynomial factors completely into linear factors if we use complex numbers. If we dont use complex numbers then polynomial with real coefficients can always be factored into linear and quadratic factors. We use this property in Section 10.7 when we study partial fractions. quadratic polynomial with no real zeros is called irre- ducible over the real numbers. Such polynomial cannot be factored without using com- plex numbers. LINEAR AND QUADRATIC FACTORS THEOREM Every polynomial with real coefficients can be factored into product of linear and irreducible quadratic factors with real coefficients. ",Quadratic function|Algebraic equation|Subtraction|Algebra|Algebra|Algebra|Algebra|Algebra|Continuous function|Fundamental theorem of algebra|Fundamental theorem of algebra|Fundamental theorem of algebra|Fundamental theorem of algebra|Fundamental theorem of algebra|Product topology|Complex conjugate|Complex conjugate|Mathematical proof|Mathematical proof|Mathematical proof|Zero of a function|Zero of a function|Polynomial|Polynomial|Polynomial|Polynomial|Polynomial|Polynomial|Polynomial|Polynomial|Polynomial|Polynomial|Polynomial|Polynomial|Polynomial|Polynomial|Polynomial|Polynomial|Polynomial|Polynomial|Polynomial|Equation|Zero (complex analysis)|Zero (complex analysis)|Zero (complex analysis)|Zero (complex analysis)|Zero (complex analysis)|Zero (complex analysis)|Zero (complex analysis)|Zero (complex analysis)|Zero (complex analysis)|Zero (complex analysis)|Zero (complex analysis)|Zero (complex analysis)|Zero (complex analysis)|Zero (complex analysis)|Zero (complex analysis)|Zero (complex analysis)|Zero (complex analysis)|Zero (complex analysis)|Zero (complex analysis)|Zero (complex analysis)|Zero (complex analysis)|Zero (complex analysis)|Zero (complex analysis)|Universal quantification|Universal quantification|Exponential function|Existential quantification|Product (mathematics)|Number|Number|Number|Number|Number|Number|Number|Number|Number|Number|Number|Multiplication|Multiplication|Multiplication|Multiplication|Multiplication|Multiplication|Multiplication|Multiplication|Multiplication|Complex number|Complex number|Complex number|Complex number|Complex number|Complex number|Derivative|Derivative|Basis (linear algebra)|Real number|Real number|Real number|Real number|Real number|Real number|Real number|Real number|Real number|Real number|Work (physics)|Linear function|Linear function|Linear function|Factorization|Factorization|Factorization|Factorization|Factorization|Factorization|Factorization|Factorization|Factorization|Factorization|Factorization|Factorization|Factorization|Factorization|Factorization|Factorization|Factorization|Factorization|Factorization|Factorization|Factorization|Partial fraction decomposition
27,27,3.7,Rational Functions,277,"Rational Functions and Asymptotes Transformations of 1x Asymptotes of Rational Functions Graphing Rational Functions Slant Asymptotes and End Behavior Applications rational function is function of the form r1x2 P1x2 Q1x where and are polynomials. We assume that P1x2 and Q1x2 have no factor in com- mon. Even though rational functions are constructed from polynomials their graphs look quite different from the graphs of polynomial functions. Rational Functions and Asymptotes Domains of rational expressions are discussed in Section 1.4. The domain of rational function consists of all real numbers except those for which the denominator is zero. When graphing rational function we must pay special attention to the behavior of the graph near those x-values. We begin by graphing very simple ra- tional function. We describe this behavior in words and in symbols as follows. The first table shows that as approaches from the left the values of f1x2 decrease without bound. In symbols f1x2 ""q as approaches negative infinity as approaches from the left The second table shows that as approaches from the right the values of f1x2 increase without bound. In symbols f1x2 as approaches infinity as approaches from the right The next two tables show how f1x2 changes as becomes large. x22 ""10 ""100 ""100000 10 100 100000 ""0.1 ""0.01 ""0.00001 Approaching Approaching x22 0.1 0.01 0.00001 Approaching Approaching These tables show that as becomes large the value of f1x2 gets closer and closer to zero. We describe this situation in symbols by writing 1x2 as ""q and f1x2 as Using the information in these tables and plotting few additional points we obtain the graph shown in Figure 1. ""2 ""1 x22 ""1 ""2 f(x) as FIGURE f1x2 f(x) as f(x) as f(x) as The function is defined for all values of other than so the domain is 5x 06 From the graph we see that the range is 5y 06 NOW TRY EXERCISE In Example we used the following arrow notation. Symbol ""q Meaning approaches from the left approaches from the right goes to negative infinity that is decreases without bound goes to infinity that is increases without bound The line is called vertical asymptote of the graph in Figure and the line is horizontal asymptote. Informally speaking an asymptote of function is line to which the graph of the function gets closer and closer as one travels along that line. DEFINITION OF VERTICAL AND HORIZONTAL ASYMPTOTES 1. The line is vertical asymptote of the function f1x2 if approaches as approaches from the right or left. as as as as 2. The line is horizontal asymptote of the function f1x2 if approaches as approaches q. as as rational function has vertical asymptotes where the function is undefined that is where the denominator is zero. Transformations of 1x rational function of the form r1x2 ax cx can be graphed by shifting stretching andor reflecting the graph of f1x2 shown in Figure using the transformations studied in Section 2.5. (Such functions are called lin- ear fractional transformations.) Asymptotes of Rational Functions The methods of Example work only for simple rational functions. To graph more com- plicated ones we need to take closer look at the behavior of rational function near its vertical and horizontal asymptotes. FINDING ASYMPTOTES OF RATIONAL FUNCTIONS Let be the rational function 1x2 n""1 n""1 m""1 m""1 1. The vertical asymptotes of are the lines where is zero of the denominator. 2. (a) If then has horizontal asymptote 0. (b) If then has horizontal asymptote (c) If then has no horizontal asymptote. Graphing Rational Functions We have seen that asymptotes are important when graphing rational functions. In general we use the following guidelines to graph rational functions. SKETCHING GRAPHS OF RATIONAL FUNCTIONS 1. Factor. fraction is if and only if its numer- ator is 0. Factor the numerator and denominator. 2. Intercepts. Find the x-intercepts by determining the zeros of the numerator and the y-intercept from the value of the function at 0. 3. Vertical Asymptotes. Find the vertical asymptotes by determining the zeros of the denominator and then see whether or ""q on each side of each vertical asymptote by using test values. 4. Horizontal Asymptote. Find the horizontal asymptote (if any) using the procedure described in the box on page 282. 5. Sketch the Graph. Graph the information provided by the first four steps. Then plot as many additional points as needed to fill in the rest of the graph of the function. Slant Asymptotes and End Behavior If r1x2 P1x 2Q1x2 is rational function in which the degree of the numerator is one more than the degree of the denominator we can use the Division Algorithm to express the function in the form R1x2 r1x ax Q1x2 where the degree of is less than the degree of and 0. This means that as R1x 2Q1x so for large values of the graph of 1x2 approaches the graph of the line ax b. In this situation we say that ax is slant asymp- tote or an oblique asymptote. Rational Function with Slant Asymptote ",Graph of a function|Graph of a function|Graph of a function|Graph of a function|Graph of a function|Graph of a function|Graph of a function|Graph of a function|Graph of a function|Graph of a function|Graph of a function|Graph of a function|Graph of a function|Graph of a function|Graph of a function|Graph of a function|Graph of a function|Graph of a function|Graph of a function|Graph of a function|Graph of a function|Graph of a function|Rational function|Rational function|Rational function|Rational function|Rational function|Rational function|Rational function|Rational function|Rational function|Rational function|Rational function|Rational function|Rational function|Rational function|Rational function|Rational function|Rational function|Rational function|Rational function|Rational function|Rational function|Inequality (mathematics)|Inequality (mathematics)|Mathematics|Point (geometry)|Point (geometry)|Subtraction|Continuous function|Domain of a function|Domain of a function|Domain of a function|Angle|Angle|Angle|Angle|Angle|Angle|Angle|Angle|Angle|Graph (mathematics)|Graph (mathematics)|Graph (mathematics)|Graph (mathematics)|Graph (mathematics)|Graph (mathematics)|Graph (mathematics)|Graph (mathematics)|Graph (mathematics)|Graph (mathematics)|Graph (mathematics)|Graph (mathematics)|Graph (mathematics)|Graph (mathematics)|Graph (mathematics)|Graph (mathematics)|Graph (mathematics)|Graph (mathematics)|Graph (mathematics)|Graph (mathematics)|Graph (mathematics)|Graph (mathematics)|Zero of a function|System of linear equations|System of linear equations|System of linear equations|System of linear equations|Polynomial|Polynomial|Polynomial|Extended real number line|Extended real number line|Sign (mathematics)|Sign (mathematics)|Algebraic expression|Zero (complex analysis)|Zero (complex analysis)|Zero (complex analysis)|Zero (complex analysis)|Zero (complex analysis)|Zero (complex analysis)|Universal quantification|Universal quantification|Function (mathematics)|Function (mathematics)|Function (mathematics)|Function (mathematics)|Function (mathematics)|Function (mathematics)|Function (mathematics)|Function (mathematics)|Function (mathematics)|Function (mathematics)|Function (mathematics)|Function (mathematics)|Function (mathematics)|Function (mathematics)|Function (mathematics)|Function (mathematics)|Function (mathematics)|Function (mathematics)|Function (mathematics)|Function (mathematics)|Function (mathematics)|Function (mathematics)|Function (mathematics)|Function (mathematics)|Function (mathematics)|Function (mathematics)|Function (mathematics)|Function (mathematics)|Function (mathematics)|Function (mathematics)|Function (mathematics)|Function (mathematics)|Function (mathematics)|Function (mathematics)|Rationalisation (mathematics)|Rationalisation (mathematics)|Rationalisation (mathematics)|Rationalisation (mathematics)|Rationalisation (mathematics)|Rationalisation (mathematics)|Rationalisation (mathematics)|Rationalisation (mathematics)|Rationalisation (mathematics)|Rationalisation (mathematics)|Rationalisation (mathematics)|Rationalisation (mathematics)|Rationalisation (mathematics)|Rationalisation (mathematics)|Rationalisation (mathematics)|Rationalisation (mathematics)|Rationalisation (mathematics)|Rationalisation (mathematics)|Rationalisation (mathematics)|Rationalisation (mathematics)|Rationalisation (mathematics)|Rationalisation (mathematics)|Number|Addition|Addition|Arithmetic mean|Arithmetic mean|Infinity|Infinity|Infinity|Infinity|Determinant|Determinant|Transformation (function)|Transformation (function)|Transformation (function)|Transformation (function)|Derivative|Real number|Work (physics)|Expression (mathematics)|Expression (mathematics)|Asymptote|Asymptote|Asymptote|Asymptote|Asymptote|Asymptote|Asymptote|Asymptote|Asymptote|Asymptote|Asymptote|Asymptote|Asymptote|Asymptote|Asymptote|Asymptote|Asymptote|Asymptote|Asymptote|Asymptote|Asymptote|Asymptote|Asymptote|Asymptote|Asymptote|Asymptote|Asymptote|Range (mathematics)|Scientific notation|Factorization|Factorization|Factorization|Homogeneous polynomial|Homogeneous polynomial|Homogeneous polynomial|Line (geometry)|Line (geometry)|Line (geometry)|Line (geometry)|Line (geometry)|Line (geometry)|Line (geometry)|Line (geometry)|List of mathematical symbols|List of mathematical symbols|List of mathematical symbols|List of mathematical symbols|List of mathematical symbols
