,Unnamed: 0,section,title,page_no,content,tagged_content
68,68,10.1,Systems of Linear Equations in Two Variables,630,Systems of Linear Equations and Their Solutions Substitution Method Elimination Method Graphical Method The Number of Solutions of Linear System in Two Variables Modeling with Linear Systems Systems of Linear Equations and Their Solutions linear equation in two variables is an equation of the form ax by The graph of linear equation is line (see Section 1.10). system of equations is set of equations that involve the same variables. system of linear equations is system of equations in which each equation is linear. solution of system is an assignment of values for the variables that makes each equation in the system true. To solve system means to find all solutions of the system. Here is an example of system of linear equations in two variables: 2x 4y Equation Equation We can check that and is solution of this system. Equation Equation 2x 4y 2132 4112 The solution can also be written as the ordered pair 13 12 Note that the graphs of Equations and are lines (see Figure 1). Since the solution 13 12 satisfies each equation the point 13 12 lies on each line. So it is the point of inter- section of the two lines. x+4y7 (3 1) 2x-y5 FIGURE Substitution Method In the substitution method we start with one equation in the system and solve for one variable in terms of the other variable. The following box describes the procedure. SUBSTITUTION METHOD 1. Solve for One Variable. Choose one equation and solve for one variable in terms of the other variable. 2. Substitute. Substitute the expression you found in Step into the other equation to get an equation in one variable then solve for that variable. 3. Back-Substitute. Substitute the value you found in Step back into the expression found in Step to solve for the remaining variable. Elimination Method To solve system using the elimination method we try to combine the equations using sums or differences so as to eliminate one of the variables. ELIMINATION METHOD 1. Adjust the Coefficients. Multiply one or more of the equations by appropri- ate numbers so that the coefficient of one variable in one equation is the nega- tive of its coefficient in the other equation. 2. Add the Equations. Add the two equations to eliminate one variable then solve for the remaining variable. 3. Back-Substitute. Substitute the value that you found in Step back into one of the original equations and solve for the remaining variable. Graphical Method In the graphical method we use graphing device to solve the system of equations. GRAPHICAL METHOD 1. Graph Each Equation. Express each equation in form suitable for the graphing calculator by solving for as function of x. Graph the equations on the same screen. 2. Find the Intersection Points. the points of intersection. The Number of Solutions of Linear System in Two Variables The graph of linear system in two variables is pair of lines so to solve the system graphically we must find the intersection point(s) of the lines. Two lines may intersect in single point they may be parallel or they may coincide as shown in Figure 5. So there are three possible outcomes in solving such system. NUMBER OF SOLUTIONS OF LINEAR SYSTEM IN TWO VARIABLES For system of linear equations in two variables exactly one of the following is true. (See Figure 5.) 1. The system has exactly one solution. 2. The system has no solution. 3. The system has infinitely many solutions. system that has no solution is said to be inconsistent system with infinitely many solutions is called dependent Modeling with Linear Systems Frequently when we use equations to solve problems in the sciences or in other areas we obtain systems like the ones weve been considering. When modeling with systems of equations we use the following guidelines which are similar to those in Section 1.6. GUIDELINES FOR MODELING WITH SYSTEMS OF EQUATIONS 1. Identify the Variables. Identify the quantities that the problem asks you to find. These are usually determined by careful reading of the question posed at the end of the problem. Introduce notation for the variables (call them and or some other letters). 2. Express All Unknown Quantities in Terms of the Variables. Read the problem again and express all the quantities mentioned in the problem in terms of the variables you defined in Step 1. 3. Set Up System of Equations. Find the crucial facts in the problem that give the relationships between the expressions you found in Step 2. Set up system of equations (or model) that expresses these relationships. 4. Solve the System and Interpret the Results. Solve the system you found in Step check your solutions and state your final answer as sentence that answers the question posed in the problem. ,Graph of a function|Graph of a function|Graph of a function|Graph of a function|Graph of a function|Graph of a function|Graph of a function|Point (geometry)|Point (geometry)|Point (geometry)|Point (geometry)|Point (geometry)|Point (geometry)|Subtraction|Simultaneous equations|Simultaneous equations|Simultaneous equations|Simultaneous equations|Simultaneous equations|Simultaneous equations|Simultaneous equations|Sum|Summation|Graph (mathematics)|Graph (mathematics)|Graph (mathematics)|Graph (mathematics)|Graph (mathematics)|Graph (mathematics)|Graph (mathematics)|Graph (mathematics)|System of linear equations|System of linear equations|System of linear equations|System of linear equations|System of linear equations|System of linear equations|Set (mathematics)|Set (mathematics)|Set (mathematics)|Equation|Equation|Equation|Equation|Equation|Equation|Equation|Equation|Equation|Equation|Equation|Equation|Equation|Equation|Equation|Equation|Equation|Equation|Equation|Equation|Equation|Equation|Equation|Equation|Equation|Equation|Equation|Equation|Equation|Equation|Equation|Equation|Equation|Equation|Equation|Equation|Equation|Equation|Equation|Universal quantification|Universal quantification|Universal quantification|Origin (mathematics)|Function (mathematics)|Number|Number|Number|Number|Multiplication|Addition|Addition|Arithmetic mean|Linear equation|Linear equation|Linear equation|Linear equation|Linear equation|Linear equation|Linear equation|Infinity|Infinity|Determinant|Derivative|Parallel (geometry)|Triangular matrix|Triangular matrix|Expression (mathematics)|Expression (mathematics)|Expression (mathematics)|Expression (mathematics)|Expression (mathematics)|Expression (mathematics)|Expression (mathematics)|Empty sum|Differential equation|Scientific notation|Change of variables|Change of variables|Change of variables|Change of variables|Change of variables|Change of variables|Change of variables|Change of variables|Homogeneous polynomial|Homogeneous polynomial|Area|Line (geometry)|Line (geometry)|Line (geometry)|Line (geometry)|Line (geometry)|Line (geometry)|Line (geometry)
69,69,10.2,Systems of Linear Equations in Several Variables,640,Solving Linear System The Number of Solutions of Linear System Modeling Using Linear Systems linear equation in variables is an equation that can be put in the form where and are real numbers and are the variables. If we have only three or four variables we generally use and instead of and Such equations are called linear because if we have just two variables the equation is which is the equation of line. Here are some examples of equations in three variables that illustrate the difference between linear and nonlinear equations. Linear equations Nonlinear equations 6x 3x 15x 10 3y 1z 12 6x Not linear because it contains the square and the square root of variable Not linear because it contains product of variables In this section we study systems of linear equations in three or more variables. Solving Linear System The following are two examples of systems of linear equations in three variables. The sec- ond system is in triangular form that is the variable doesnt appear in the second equation and the variables and do not appear in the third equation. system of linear equations system in triangular form 2y 3y 3z 2x 3y 10 2y 2z Its easy to solve system that is in triangular form by using back-substitution. So our goal in this section is to start with system of linear equations and change it to system in triangular form that has the same solutions as the original system. We begin by show- ing how to use back-substitution to solve system that is already in triangular form. OPERATIONS THAT YIELD AN EQUIVALENT SYSTEM 1. Add nonzero multiple of one equation to another. 2. Multiply an equation by nonzero constant. 3. Interchange the positions of two equations. To solve linear system we use these operations to change the system to an equiva- lent triangular system. Then we use back-substitution as in Example 1. This process is called Gaussian elimination The Number of Solutions of Linear System The graph of linear equation in three variables is plane in three dimensional space (see Section 9.6). system of three equations in three variables represents three planes in space. The solutions of the system are the points where all three planes intersect. Three planes may intersect in point line not at all or all three planes may coincide. Figure illustrates some of these possibilities. Checking these possibilities we see that there are three possible outcomes when solving such system. NUMBER OF SOLUTIONS OF LINEAR SYSTEM For system of linear equations exactly one of the following is true. 1. The system has exactly one solution. 2. The system has no solution. 3. The system has infinitely many solutions. system with no solutions is said to be inconsistent and system with infinitely many solutions is said to be dependent As we see in the next example linear system has no solution if we end up with false equation after applying Gaussian elimination to the system. Modeling Using Linear Systems Linear systems are used to model situations that involve several varying quantities. In the next example we consider an application of linear systems to finance. ,Triangle|Triangle|Triangle|Triangle|Triangle|Triangle|Graph of a function|Plane (geometry)|Plane (geometry)|Plane (geometry)|Plane (geometry)|Plane (geometry)|Mathematics|Mathematics|Point (geometry)|Point (geometry)|Subtraction|Simultaneous equations|Simultaneous equations|Product topology|Inverse trigonometric functions|Square (algebra)|Square (algebra)|Graph (mathematics)|System of linear equations|System of linear equations|System of linear equations|System of linear equations|System of linear equations|Operation (mathematics)|Operation (mathematics)|Sign (mathematics)|Equation|Equation|Equation|Equation|Equation|Equation|Equation|Equation|Equation|Equation|Equation|Equation|Equation|Equation|Equation|Equation|Equation|Equation|Equation|Equation|Equation|Equation|Universal quantification|Universal quantification|Universal quantification|Origin (mathematics)|Square root|Nth root|Product (mathematics)|Position (vector)|Number|Number|Number|Number|Multiplication|Multiplication|Multiplication|Addition|Linear equation|Linear equation|Linear equation|Linear equation|Linear equation|Linear equation|Linear equation|Linear equation|Infinity|Infinity|Matrix (mathematics)|Matrix (mathematics)|Derivative|Real number|Triangular matrix|Triangular matrix|Triangular matrix|Triangular matrix|Triangular matrix|Triangular matrix|Triangular matrix|Triangular matrix|Integer|Integer|Integer|Homogeneous polynomial|Homogeneous polynomial|Homogeneous polynomial|Homogeneous polynomial|Homogeneous polynomial|Homogeneous polynomial|Line (geometry)|Line (geometry)
70,70,10.3,Matrices and Systems of Linear Equations,649,"Matrices The Augmented Matrix of Linear System Elementary Row Operations Gaussian Elimination Gauss-Jordan Elimination Inconsistent and Dependent Systems Modeling with Linear Systems matrix is simply rectangular array of numbers. Matrices* are used to organize informa- tion into categories that correspond to the rows and columns of the matrix. For example scientist might organize information on population of endangered whales as follows: Immature Juvenile 12 15 52 42 Male Female Adult 18 11 This is compact way of saying that there are 12 immature males 15 immature females 18 adult males and so on. In this section we represent linear system by matrix called the augmented matrix of the system: Linear system 2x 4y Augmented matrix Equation Equation The augmented matrix contains the same information as the system but in simpler form. The operations we learned for solving systems of equations can now be performed on the augmented matrix. Matrices We begin by defining the various elements that make up matrix. DEFINITION OF MATRIX An matrix is rectangular array of numbers with rows and columns 12 13 22 23 32 33 m2 m3 columns 1n 2n 3n rows mn 11 21 31 m1 We say that the matrix has dimension n. The numbers ij are the entries of the matrix. The subscript on the entry ij indicates that it is in the ith row and the jth column. The Augmented Matrix of Linear System We can write system of linear equations as matrix called the augmented matrix of the system by writing only the coefficients and constants that appear in the equations. Here is an example. Linear system Augmented matrix 3x 2y 3y 4z 11 11 Notice that missing variable in an equation corresponds to entry in the augmented matrix. Elementary Row Operations The operations that we used in Section 10.2 to solve linear systems correspond to opera- tions on the rows of the augmented matrix of the system. For example adding multiple of one equation to another corresponds to adding multiple of one row to another. ELEMENTARY ROW OPERATIONS 1. Add multiple of one row to another. 2. Multiply row by nonzero constant. 3. Interchange two rows. Note that performing any of these operations on the augmented matrix of system does not change its solution. We use the following notation to describe the elementary row operations: Symbol Description kR Change the ith row by adding times row to it and then put the result back in row i. kR Multiply the ith row by k. Interchange the ith and jth rows. In the next example we compare the two ways of writing systems of linear equations. Note that performing any of these operations on the augmented matrix of system does not change its solution. We use the following notation to describe the elementary row operations: Symbol Description kR Change the ith row by adding times row to it and then put the result back in row i. kR Multiply the ith row by k. Interchange the ith and jth rows. In the next example we compare the two ways of writing systems of linear equations. Gaussian Elimination In general to solve system of linear equations using its augmented matrix we use ele- mentary row operations to arrive at matrix in certain form. This form is described in the following box. ROW-ECHELON FORM AND REDUCED ROW-ECHELON FORM OF MATRIX matrix is in row-echelon form if it satisfies the following conditions. 1. The first nonzero number in each row (reading from left to right) is 1. This is called the leading entry. 2. The leading entry in each row is to the right of the leading entry in the row immediately above it. 3. All rows consisting entirely of zeros are at the bottom of the matrix. matrix is in reduced row-echelon form if it is in row-echelon form and also satisfies the following condition. 4. Every number above and below each leading entry is 0. In the following matrices the first one is not in row-echelon form. The second one is in row-echelon form and the third one is in reduced row-echelon form. The entries in red are the leading entries. Not in row-echelon form 12 ""5 0.4 Row-echelon form ""6 10 Reduced row-echelon form ""3 Leading 1s shift to the right in successive rows Leading 1s do not shift to the right in successive rows ""3 Leading 1s have 0s above and below them Here is systematic way to put matrix in row-echelon form using elementary row operations: Start by obtaining in the top left corner. Then obtain zeros below that by adding appropriate multiples of the first row to the rows below it. Next obtain leading in the next row and then obtain zeros below that 1. At each stage make sure that every leading entry is to the right of the leading entry in the row above itrearrange the rows if necessary. Continue this process until you arrive at matrix in row-echelon form. This is how the process might work for matrix: Once an augmented matrix is in row-echelon form we can solve the corresponding lin- ear system using back-substitution. This technique is called Gaussian elimination in honor of its inventor the German mathematician C. F. Gauss (see page 272). SOLVING SYSTEM USING GAUSSIAN ELIMINATION 1. Augmented Matrix. Write the augmented matrix of the system. 2. Row-Echelon Form. Use elementary row operations to change the aug- mented matrix to row-echelon form. 3. Back-Substitution. Write the new system of equations that corresponds to the row-echelon form of the augmented matrix and solve by back-substitution. Gauss-Jordan Elimination If we put the augmented matrix of linear system in reduced row-echelon form then we dont need to back-substitute to solve the system. To put matrix in reduced row-echelon form we use the following steps. Use the elementary row operations to put the matrix in row-echelon form. Obtain zeros above each leading entry by adding multiples of the row containing that entry to the rows above it. Begin with the last leading entry and work up. Here is how the process works for matrix: Using the reduced row-echelon form to solve system is called Gauss-Jordan elimina- tion The process is illustrated in the next example. Inconsistent and Dependent Systems The systems of linear equations that we considered in Examples 14 had exactly one solution. But as we know from Section 10.2 linear system may have one solution no solution or infinitely many solutions. Fortunately the row-echelon form of sys- tem allows us to determine which of these cases applies as described in the following box. First we need some terminology. leading variable in linear system is one that corresponds to leading entry in the row-echelon form of the augmented matrix of the system. THE SOLUTIONS OF LINEAR SYSTEM IN ROW-ECHELON FORM Suppose the augmented matrix of system of linear equations has been trans- formed by Gaussian elimination into row-echelon form. Then exactly one of the following is true. 1. No solution. If the row-echelon form contains row that represents the equa- tion where is not zero then the system has no solution. system with no solution is called inconsistent. 2. One solution. If each variable in the row-echelon form is leading variable then the system has exactly one solution which we find using back-substitution or Gauss-Jordan elimination. 3. Infinitely many solutions. If the variables in the row-echelon form are not all leading variables and if the system is not inconsistent then it has infinitely many solutions. In this case the system is called dependent. We solve the sys- tem by putting the matrix in reduced row-echelon form and then expressing the leading variables in terms of the nonleading variables. The nonleading variables may take on any real numbers as their values. Modeling with Linear Systems Linear equations often containing hundreds or even thousands of variables occur fre- quently in the applications of algebra to the sciences and to other fields. For now lets consider an example that involves only three variables. ",Rectangle|Rectangle|Mathematics|Mathematics|Mathematics|Mathematics|Mathematics|Algebra|Continuous function|Continuous function|Simultaneous equations|Simultaneous equations|System of linear equations|System of linear equations|System of linear equations|System of linear equations|System of linear equations|System of linear equations|Operation (mathematics)|Operation (mathematics)|Operation (mathematics)|Operation (mathematics)|Operation (mathematics)|Operation (mathematics)|Operation (mathematics)|Operation (mathematics)|Operation (mathematics)|Operation (mathematics)|Operation (mathematics)|Operation (mathematics)|Operation (mathematics)|Equation|Equation|Equation|Equation|Equation|Equation|Equation|Equation|Equation|Equation|Equation|Equation|Equation|Equation|Zero (complex analysis)|Zero (complex analysis)|Zero (complex analysis)|Zero (complex analysis)|Zero (complex analysis)|Universal quantification|Universal quantification|Number|Number|Number|Number|Number|Number|Multiplication|Multiplication|Multiplication|Multiplication|Multiplication|Multiplication|Multiplication|Multiplication|Addition|Linear equation|Linear equation|Linear equation|Linear equation|Linear equation|Linear equation|Linear equation|Infinity|Infinity|Infinity|Determinant|Matrix (mathematics)|Matrix (mathematics)|Matrix (mathematics)|Matrix (mathematics)|Matrix (mathematics)|Matrix (mathematics)|Matrix (mathematics)|Matrix (mathematics)|Matrix (mathematics)|Matrix (mathematics)|Matrix (mathematics)|Matrix (mathematics)|Matrix (mathematics)|Matrix (mathematics)|Matrix (mathematics)|Matrix (mathematics)|Matrix (mathematics)|Matrix (mathematics)|Matrix (mathematics)|Matrix (mathematics)|Matrix (mathematics)|Matrix (mathematics)|Matrix (mathematics)|Matrix (mathematics)|Matrix (mathematics)|Matrix (mathematics)|Matrix (mathematics)|Matrix (mathematics)|Matrix (mathematics)|Matrix (mathematics)|Matrix (mathematics)|Matrix (mathematics)|Matrix (mathematics)|Matrix (mathematics)|Matrix (mathematics)|Matrix (mathematics)|Matrix (mathematics)|Matrix (mathematics)|Matrix (mathematics)|Matrix (mathematics)|Matrix (mathematics)|Matrix (mathematics)|Derivative|Real number|Work (physics)|Work (physics)|Work (physics)|Triangular matrix|Triangular matrix|Triangular matrix|Triangular matrix|Triangular matrix|Integer|Expression (mathematics)|Elementary matrix|Elementary matrix|Elementary matrix|Elementary matrix|Elementary matrix|Elementary matrix|Elementary matrix|Elementary matrix|Elementary matrix|Scientific notation|Scientific notation|Homogeneous polynomial|Homogeneous polynomial|Homogeneous polynomial|Homogeneous polynomial|Homogeneous polynomial|Homogeneous polynomial|Homogeneous polynomial|Homogeneous polynomial|Homogeneous polynomial|Homogeneous polynomial|Homogeneous polynomial|Homogeneous polynomial|Homogeneous polynomial|Homogeneous polynomial|Homogeneous polynomial|Homogeneous polynomial|Homogeneous polynomial|Homogeneous polynomial|Homogeneous polynomial|Homogeneous polynomial|Homogeneous polynomial|Homogeneous polynomial|Homogeneous polynomial|Homogeneous polynomial|Homogeneous polynomial|Homogeneous polynomial|Homogeneous polynomial|Homogeneous polynomial|Homogeneous polynomial|Homogeneous polynomial|Homogeneous polynomial|Homogeneous polynomial|Homogeneous polynomial|List of mathematical symbols|List of mathematical symbols
