,Unnamed: 0,section,title,page_no,content,tagged_content
0,0,1,FUNDAMENTALS,1,In this first chapter we review the real numbers equations and the coordinate plane. You are probably already familiar with these concepts but it is help- ful to get fresh look at how these ideas work together to solve problems and model (or describe) real-world situations. Lets see how all these ideas are used in real-life situation: Suppose you get paid an hour at your part-time job. We can model your pay for working hours by the equation 9x To find out how many hours you need to work to get paid 200 dollars we solve the equation 200 9x Graphing the equation 9x in coordinate plane helps us see how pay increases with hours worked. ,Graph of a function|Plane (geometry)|Plane (geometry)|Graph (mathematics)|Equation|Equation|Equation|Equation|Universal quantification|Coordinate system|Coordinate system|Number|Basis (linear algebra)|Basis (linear algebra)|Real number|Work (physics)|Work (physics)|Work (physics)|Work (physics)
1,1,1.1,Real Numbers,2,Properties of Real Numbers Addition and Subtraction Multiplication and Division The Real Line Sets and Intervals Absolute Value and Distance Lets review the types of numbers that make up the real number system. We start with the natural numbers: The different types of real numbers were invented to meet specific needs. For example natural numbers are needed for counting negative num- bers for describing debt or below-zero temperatures rational numbers for concepts like half gallon of milk and irrational numbers for measuring certain distances like the diagonal of square. The integers consist of the natural numbers together with their negatives and 0: We construct the rational numbers by taking ratios of integers. Thus any rational num- ber can be expressed as where and are integers and 0. Examples are 37 46 461 17 0.17 100 (Recall that division by is always ruled out so expressions like 30 and 00 are undefined.) There are also real numbers such as 12 that cannot be expressed as ratio of integers and are therefore called irrational numbers. It can be shown with varying degrees of difficulty that these numbers are also irrational: 13 15 The set of all real numbers is usually denoted by the symbol When we use the word number without qualification we will mean real number. Figure is diagram of the types of real numbers that we work with in this book. Every real number has decimal representation. If the number is rational then its cor- responding decimal is repeating. For example 157 495 0.5000. 0.50 0.66666. 0.6 0.3171717. 0.317 1.285714285714. 1.285714 (The bar indicates that the sequence of digits repeats forever.) If the number is irrational the decimal representation is nonrepeating: 12 1.414213562373095. 3.141592653589793. If we stop the decimal expansion of any number at certain place we get an approxima- tion to the number. For instance we can write 3.14159265 where the symbol is read is approximately equal to. The more decimal places we re- tain the better our approximation. Properties of Real Numbers We all know that and and 513 87 87 513 and so on. In algebra we express all these (infinitely many) facts by writing where and stand for any two numbers. In other words is concise way of saying that when we add two numbers the order of addition doesnt matter. This fact is called the Commutative Property for addition. From our experience with numbers we know that the properties in the following box are also valid. The Distributive Property applies whenever we multiply number by sum. Figure explains why this property works for the case in which all the numbers are pos- itive integers but the property is true for any real numbers and c. Addition and Subtraction Dont assume that is negative number. Whether is negative or positive depends on the value of a. For example if then negative number but if then 15 (Property 2) pos- itive number. The number is special for addition it is called the additive identity because for any real number a. Every real number has negative that satisfies 1a Subtraction is the operation that undoes addition to subtract number from another we simply add the negative of that number. By definition 1b2 To combine real numbers involving negatives we use the following properties. Multiplication and Division The number is special for multiplication it is called the multiplicative identity because for any real number a. Every nonzero real number has an inverse 1a that satisfies 11a2 Division is the operation that undoes multiplication to divide by number we multiply by the inverse of that number. If then by definition We write 11b2 as simply ab. We refer to ab as the quotient of and or as the frac- When adding fractions with different denominators we dont usually use Property 4. Instead we rewrite the fractions so that they have the smallest possible common de- nominator (often smaller than the product of the denominators) and then we use Prop- erty 3. This denominator is the Least Common Denominator (LCD) described in the next example. The Real Line The real numbers can be represented by points on line as shown in Figure 3. The pos- itive direction (toward the right) is indicated by an arrow. We choose an arbitrary refer- ence point called the origin which corresponds to the real number 0. Given any con- venient unit of measurement each positive number is represented by the point on the line distance of units to the right of the origin and each negative number is repre- sented by the point units to the left of the origin. The number associated with the point is called the coordinate of and the line is then called coordinate line or real number line or simply real line. Often we identify the point with its coordinate and think of number as being point on the real line. Sets and Intervals set is collection of objects and these objects are called the elements of the set. If is set the notation means that is an element of and means that is not an element of S. For example if represents the set of integers then but Z. Some sets can be described by listing their elements within braces. For instance the set that consists of all positive integers less than can be written as 51 66 We could also write in set-builder notation as 5x is an integer and 76 which is read is the set of all such that is an integer and 7. If and are sets then their union is the set that consists of all elements that are in or (or in both). The intersection of and is the set consisting of all el- ements that are in both and T. In other words is the common part of and T. The empty set denoted by is the set that contains no element. Certain sets of real numbers called intervals occur frequently in calculus and corre- spond geometrically to line segments. If then the open interval from to con- sists of all numbers between and and is denoted 1a b2 The closed interval from to includes the endpoints and is denoted 3a b4 Using set-builder notation we can write 1a b2 5x b6 3a b4 5x b6 Note that parentheses in the interval notation and open circles on the graph in Figure indicate that endpoints are excluded from the interval whereas square brackets and solid circles in Figure indicate that the endpoints are included. Intervals may also include one endpoint but not the other or they may extend infinitely far in one direction or both. The following table lists the possible types of inter No Smallest or Largest Number in an Open Interval Any interval contains infinitely many numbersevery point on the graph of an interval corresponds to real num- ber. In the closed interval 30 the smallest number is and the largest is but the open interval 10 12 contains no smallest or largest number. To see this note that 0.01 is close to zero but 0.001 is closer 0.0001 is closer yet and so on. We can always find number in the interval 10 closer to zero than any given number. Since itself is not in the interval the interval contains no smallest number. Similarly 0.99 is close to but 0.999 is closer 0.9999 closer yet and so on. Since itself is not in the interval the interval has no largest number. Absolute Value and Distance |5 (1 NOW TRY EXERCISE 59 |3 3) 0.0001 The absolute value of number denoted by is the distance from to on the real number line (see Figure 9). Distance is always positive or zero so we have for every number ,Calculus|Graph of a function|Graph of a function|Inequality (mathematics)|Inequality (mathematics)|Mereology|Point (geometry)|Point (geometry)|Point (geometry)|Point (geometry)|Point (geometry)|Point (geometry)|Point (geometry)|Point (geometry)|Subtraction|Subtraction|Subtraction|Subtraction|Subtraction|Subtraction|Commutative property|Algebra|Continuous function|Associative property|Product topology|Set-builder notation|Set-builder notation|Open set|Open set|Open set|Open set|Circle|Circle|Closed set|Closed set|Closed set|Closed set|Identity (mathematics)|Identity (mathematics)|Square (algebra)|Square (algebra)|Natural number|Natural number|Natural number|Natural number|Sum|Summation|Line segment|Graph (mathematics)|Graph (mathematics)|Graph (mathematics)|Empty set|Division (mathematics)|Interval (mathematics)|Interval (mathematics)|Interval (mathematics)|Interval (mathematics)|Interval (mathematics)|Interval (mathematics)|Interval (mathematics)|Interval (mathematics)|Interval (mathematics)|Interval (mathematics)|Interval (mathematics)|Interval (mathematics)|Interval (mathematics)|Interval (mathematics)|Interval (mathematics)|Interval (mathematics)|Interval (mathematics)|Interval (mathematics)|Negative number|Negative number|Negative number|Operation (mathematics)|Operation (mathematics)|Set (mathematics)|Set (mathematics)|Set (mathematics)|Set (mathematics)|Set (mathematics)|Set (mathematics)|Set (mathematics)|Set (mathematics)|Set (mathematics)|Set (mathematics)|Set (mathematics)|Set (mathematics)|Set (mathematics)|Set (mathematics)|Set (mathematics)|Set (mathematics)|Division by zero|Sign (mathematics)|Sign (mathematics)|Sign (mathematics)|Sign (mathematics)|Sign (mathematics)|Sign (mathematics)|Sign (mathematics)|Sign (mathematics)|Sign (mathematics)|Sign (mathematics)|Sign (mathematics)|Sign (mathematics)|Sign (mathematics)|Zero (complex analysis)|Zero (complex analysis)|Zero (complex analysis)|Universal quantification|Universal quantification|Universal quantification|Universal quantification|Universal quantification|Universal quantification|Universal quantification|Universal quantification|Universal quantification|Universal quantification|Universal quantification|Universal quantification|Universal quantification|Universal quantification|Universal quantification|Origin (mathematics)|Origin (mathematics)|Origin (mathematics)|Coordinate system|Coordinate system|Coordinate system|Rationalisation (mathematics)|Rationalisation (mathematics)|Rationalisation (mathematics)|Rationalisation (mathematics)|Product (mathematics)|Rational number|Rational number|Position (vector)|Position (vector)|Position (vector)|Position (vector)|Number|Number|Number|Number|Number|Number|Number|Number|Number|Number|Number|Number|Number|Number|Number|Number|Number|Number|Number|Number|Number|Number|Number|Number|Number|Number|Number|Number|Number|Number|Number|Number|Number|Number|Number|Number|Number|Number|Number|Number|Number|Number|Number|Number|Number|Number|Number|Number|Number|Number|Number|Number|Number|Number|Number|Number|Number|Number|Number|Number|Number|Number|Multiplication|Multiplication|Multiplication|Multiplication|Multiplication|Multiplication|Multiplication|Multiplication|Union (set theory)|Addition|Addition|Addition|Addition|Addition|Addition|Addition|Addition|Addition|Arithmetic mean|Arithmetic mean|Arithmetic mean|Absolute value|Absolute value|Absolute value|Absolute value|Absolute value|Infinity|Infinity|Infinity|Matrix (mathematics)|Matrix (mathematics)|Derivative|Derivative|Equality (mathematics)|Real line|Real line|Real line|Real line|Real line|Real line|Basis (linear algebra)|Basis (linear algebra)|Basis (linear algebra)|Real number|Real number|Real number|Real number|Real number|Real number|Real number|Real number|Real number|Real number|Real number|Real number|Real number|Real number|Real number|Real number|Real number|Real number|Real number|Real number|Real number|Real number|Real number|Real number|Real number|Work (physics)|Work (physics)|Integer|Integer|Integer|Integer|Integer|Integer|Integer|Integer|Integer|Integer|Expression (mathematics)|Expression (mathematics)|Expression (mathematics)|Expression (mathematics)|Empty sum|Differential equation|Distance|Distance|Distance|Distance|Distance|Distance|Geometry|Scientific notation|Scientific notation|Scientific notation|Scientific notation|Line (geometry)|Line (geometry)|Line (geometry)|Line (geometry)|Line (geometry)|Line (geometry)|Line (geometry)|Line (geometry)|Line (geometry)|Line (geometry)|Line (geometry)|Distributive property|List of mathematical symbols|List of mathematical symbols|Equality
2,2,1.2,Exponents and Radicals,12,In this section we give meaning to expressions such as mn in which the exponent mn is rational number. To do this we need to recall some facts about integer exponents radi- cals and nth roots. Integer Exponents product of identical numbers is usually written in exponential notation. For example is written as In general we have the following definition. EXPONENTIAL NOTATION If is any real number and is positive integer then the nth power of is 1442443 factors The number is called the base and is called the exponent. We can state several useful rules for working with exponential notation. To discover the rule for multiplication we multiply by 21 42 1444244 43 123 1444442444443 factors factors factors It appears that to multiply two powers of the same base we add their exponents. In gen- eral for any real number and any positive integers and we have mn 144 4244 43 1442443 factors factors 144424443 factors Thus mn We would like this rule to be true even when and are or negative integers. For instance we must have 03 But this can happen only if 1. Likewise we want to have 142 44 and this will be true if 15 These observations lead to the following definition. Rules for Working with Exponents Familiarity with the following rules is essential for our work with exponents and bases. In the table the bases and are real numbers and the exponents and are integers. PROOF OF LAW If and are positive integers we have PROOF OF LAW If is positive integer we have Here we have used the Commutative and Associative Properties repeatedly. If Law can be proved by using the definition of negative exponents. When simplifying an expression you will find that many different methods will lead to the same result you should feel free to use any of the rules of exponents to arrive at your own method. We now give two additional laws that are useful in simplifying ex- pressions with negative exponents. Using the definition of negative exponents and then Property of fractions (page 5) we have Scientific Notation Scientists use exponential notation as compact way of writing very large numbers and very small numbers. For example the nearest star beyond the sun Proxima Centauri is approximately 40000000000000 km away. The mass of hydrogen atom is about 0.00000000000000000000000166 g. Such numbers are difficult to read and to write so scientists usually express them in scientific notation. SCIENTIFIC NOTATION positive number is said to be written in scientific notation if it is expressed as follows: Scientific notation is often used on calculator to display very large or very small number. For instance if we use calculator to square the number 1111111 the display panel may show (depending on the calculator model) the approximation 1.234568 12 or 1.23468 12 Here the final digits indicate the power of 10 and we interpret the result as 1.234568 10 12 Radicals We know what means whenever is an integer. To give meaning to power such as 45 whose exponent is rational number we need to discuss radicals. The symbol means the positive square root of. Thus Square roots are special cases of nth roots. The nth root of is the number that when raised to the nth power gives x. Rational Exponents To define what is meant by rational exponent or equivalently fractional exponent such as 13 we need to use radicals. To give meaning to the symbol 1n in way that is con- sistent with the Laws of Exponents we would have to have With this definition it can be proved that the Laws of Exponents also hold for rational exponents. Rationalizing the Denominator It is often useful to eliminate the radical in denominator by multiplying both numerator and denominator by an appropriate expression. This procedure is called rationalizing the denominator. If the denominator is of the form 1a we multiply numerator and denom- inator by 1a In doing this we multiply the given quantity by so we do not change its value. For instance 1a 1a 1a 1a 1a 1a Note that the denominator in the last fraction contains no radical. In general if the de- nominator is of the form with then multiplying the numerator and denomi- nm nator by will rationalize the denominator because (for 0) ,Mathematics|Subtraction|Commutative property|Associative property|Product topology|Identity (mathematics)|Square (algebra)|Square (algebra)|Square (algebra)|Mathematical proof|Mathematical proof|Mathematical proof|Mathematical proof|Natural number|Natural number|Natural number|Natural number|Base (exponentiation)|Base (exponentiation)|Base (exponentiation)|Base (exponentiation)|Sign (mathematics)|Sign (mathematics)|Sign (mathematics)|Sign (mathematics)|Sign (mathematics)|Sign (mathematics)|Sign (mathematics)|Sign (mathematics)|Sign (mathematics)|Sign (mathematics)|Universal quantification|Exponential function|Exponential function|Exponential function|Exponential function|Exponential function|Function (mathematics)|Square root|Square root|Rationalisation (mathematics)|Rationalisation (mathematics)|Rationalisation (mathematics)|Rationalisation (mathematics)|Rationalisation (mathematics)|Rationalisation (mathematics)|Rationalisation (mathematics)|Rationalisation (mathematics)|Nth root|Nth root|Nth root|Nth root|Nth root|Product (mathematics)|Rational number|Rational number|Position (vector)|Position (vector)|Position (vector)|Position (vector)|Position (vector)|Position (vector)|Number|Number|Number|Number|Number|Number|Number|Number|Number|Number|Number|Number|Number|Number|Multiplication|Multiplication|Multiplication|Multiplication|Multiplication|Multiplication|Multiplication|Multiplication|Addition|Addition|Arithmetic mean|Arithmetic mean|Arithmetic mean|Arithmetic mean|Arithmetic mean|Matrix (mathematics)|Matrix (mathematics)|Matrix (mathematics)|Derivative|Real number|Real number|Real number|Work (physics)|Work (physics)|Work (physics)|Integer|Integer|Integer|Integer|Integer|Integer|Integer|Integer|Integer|Expression (mathematics)|Expression (mathematics)|Expression (mathematics)|Expression (mathematics)|Expression (mathematics)|Exponentiation|Exponentiation|Exponentiation|Exponentiation|Exponentiation|Exponentiation|Exponentiation|Exponentiation|Exponentiation|Exponentiation|Exponentiation|Exponentiation|Exponentiation|Exponentiation|Exponentiation|Exponentiation|Exponentiation|Exponentiation|Exponentiation|Exponentiation|Exponentiation|Exponentiation|Exponentiation|Exponentiation|Exponentiation|Exponentiation|Exponentiation|Exponentiation|Scientific notation|Scientific notation|Scientific notation|Scientific notation|Scientific notation|Scientific notation|Scientific notation|Scientific notation|Scientific notation|Factorization|Factorization|Factorization|Factorization|Factorization|Factorization|Factorization|Homogeneous polynomial|Homogeneous polynomial|List of mathematical symbols|List of mathematical symbols
3,3,1.3,Algebraic Expressions,24,Adding and Subtracting Polynomials Multiplying Algebraic Expressions Special Product Formulas Factoring Common Factors Factoring Trinomials Special Factoring Formulas Factoring by Grouping Terms variable is letter that can represent any number from given set of numbers. If we start with variables such as and and some real numbers and combine them using addition subtraction multiplication division powers and roots we obtain an algebraic expression. Here are some examples: 2x 3x 1x 10 2z monomial is an expression of the form ax where is real number and is non- negative integer. binomial is sum of two monomials and trinomial is sum of three monomials. In general sum of monomials is called polynomial. For example the first expression listed above is polynomial but the other two are not. POLYNOMIALS polynomial in the variable is an expression of the form n1 n1 where are real numbers and is nonnegative integer. If then the polynomial has degree n. The monomials that make up the poly- nomial are called the terms of the polynomial. Note that the degree of polynomial is the highest power of the variable that appears in the polynomial. Adding and Subtracting Polynomials Distributive Property ac bc 1a b2c We add and subtract polynomials using the properties of real numbers that were dis- cussed in Section 1.1. The idea is to combine like terms (that is terms with the same vari- ables raised to the same powers) using the Distributive Property. For instance 5x 3x 15 32x 8x In subtracting polynomials we have to remember that if minus sign precedes an ex- pression in parentheses then the sign of every term within the parentheses is changed when we remove the parentheses: 1b c2 This is simply case of the Distributive Property a1b c2 ab ac with 1. Multiplying Algebraic Expressions To find the product of polynomials or other algebraic expressions we need to use the Distributive Property repeatedly. In particular using it three times on the product of two binomials we get The acronym FOIL helps us remember that the product of two binomials is the sum of the products of the First terms the Outer terms the Inner terms and the Last terms. 1a b2 1c d2 a1c d2 b1c d2 ac ad bc bd This says that we multiply the two factors by multiplying each term in one factor by each term in the other factor and adding these products. Schematically we have When we multiply trinomials or other polynomials with more terms we use the Dis- tributive Property. It is also helpful to arrange our work in table form. The next example illustrates both methods. Special Product Formulas Certain types of products occur so frequently that you should memorize them. You can verify the following formulas by performing the multiplications. The key idea in using these formulas (or any other formula in algebra) is the Principle of Substitution: We may substitute any algebraic expression for any letter in formula. For example to find 1x we use Product Formula substituting for and for to get Factoring Common Factors We use the Distributive Property to expand algebraic expressions. We sometimes need to reverse this process (again using the Distributive Property) by factoring an expression as product of simpler ones. For example we can write Factoring Trinomials To factor trinomial of the form bx we note that 1x 1x 1r 2x rs so we need to choose numbers and so that and rs c. ,Mathematics|Subtraction|Subtraction|Subtraction|Subtraction|Subtraction|Algebra|Algebra|Algebra|Algebra|Algebra|Algebra|Algebra|Continuous function|Continuous function|Continuous function|Continuous function|Product topology|Product topology|Product topology|Product topology|Product topology|Product topology|Product topology|Product topology|Product topology|Product topology|Binomial|Binomial|Binomial|Monomial|Monomial|Monomial|Monomial|Monomial|Natural number|Sum|Sum|Sum|Sum|Summation|Summation|Summation|Summation|System of linear equations|Polynomial|Polynomial|Polynomial|Polynomial|Polynomial|Polynomial|Polynomial|Polynomial|Polynomial|Polynomial|Polynomial|Polynomial|Polynomial|Polynomial|Set (mathematics)|Sign (mathematics)|Sign (mathematics)|Sign (mathematics)|Sign (mathematics)|Algebraic expression|Algebraic expression|Algebraic expression|Algebraic expression|Algebraic expression|Algebraic expression|Universal quantification|Exponential function|Nth root|Product (mathematics)|Product (mathematics)|Product (mathematics)|Product (mathematics)|Product (mathematics)|Product (mathematics)|Product (mathematics)|Product (mathematics)|Product (mathematics)|Product (mathematics)|Number|Number|Number|Number|Number|Number|Number|Multiplication|Multiplication|Multiplication|Multiplication|Multiplication|Multiplication|Multiplication|Multiplication|Multiplication|Multiplication|Multiplication|Multiplication|Multiplication|Multiplication|Multiplication|Multiplication|Multiplication|Addition|Addition|Absolute value|Absolute value|Formula|Formula|Formula|Formula|Formula|Formula|Formula|Formula|Real number|Real number|Real number|Real number|Work (physics)|Integer|Integer|Integer|Expression (mathematics)|Expression (mathematics)|Expression (mathematics)|Expression (mathematics)|Expression (mathematics)|Expression (mathematics)|Expression (mathematics)|Expression (mathematics)|Expression (mathematics)|Expression (mathematics)|Empty sum|Empty sum|Empty sum|Empty sum|Exponentiation|Exponentiation|Exponentiation|Factorization|Factorization|Factorization|Factorization|Factorization|Factorization|Factorization|Factorization|Factorization|Factorization|Factorization|Factorization|Factorization|Change of variables|Change of variables|Change of variables|Homogeneous polynomial|Homogeneous polynomial|Homogeneous polynomial|Homogeneous polynomial|Distributive property|Distributive property|Distributive property|Distributive property|Distributive property|Distributive property
