,Unnamed: 0,section,title,page_no,content,tagged_content
45,45,6.3,Trigonometric Functions of Angles,451,Trigonometric Functions of Angles Evaluating Trigonometric Functions at Any Angle Trigonometric Identities Areas of Triangles In the preceding section we defined the trigonometric ratios for acute angles. Here we ex- tend the trigonometric ratios to all angles by defining the trigonometric functions of an- gles. With these functions we can solve practical problems that involve angles that are not necessarily acute. Trigonometric Functions of Angles Let POQ be right triangle with acute angle as shown in Figure 1(a). Place in stan- dard position as shown in Figure 1(b). opposite hypotenuse adjacent (x y) (a) (b) FIGURE Then P1x is point on the terminal side of u. In triangle POQ the opposite side has length and the adjacent side has length x. Using the Pythagorean Theorem we see that the hypotenuse has length 2x So P(x y) sin cos tan The other trigonometric ratios can be found in the same way. These observations allow us to extend the trigonometric ratios to any angle. We define the trigonometric functions of angles as follows (see Figure 2). FIGURE DEFINITION OF THE TRIGONOMETRIC FUNCTIONS Let be an angle in standard position and let P1x y2 be point on the terminal side. If 2x is the distance from the origin to the point P1x y2 then P(x y) P(x y) FIGURE sin csc 1y 02 cos sec 1x 02 tan cot 1x 02 02 Since division by is an undefined operation certain trigonometric functions are not defined for certain angles. For example tan 90 yx is undefined because 0. The angles for which the trigonometric functions may be undefined are the angles for which either the x- or y-coordinate of point on the terminal side of the angle is 0. These are quadrantal anglesangles that are coterminal with the coordinate axes. It is crucial fact that the values of the trigonometric functions do not depend on the choice of the point P1x y2 This is because if P1x is any other point on the terminal side as in Figure then triangles POQ and P(OQ( are similar. Evaluating Trigonometric Functions at Any Angle From the definition we see that the values of the trigonometric functions are all positive if the angle has its terminal side in Quadrant I. This is because and are positive in this quadrant. Of course is always positive since it is simply the distance from the ori- gin to the point P1x If the terminal side of is in Quadrant II however then is You may have already studied the trigonometric functions defined using the unit circle (Chapter 5). To see how they relate to the trigonometric func- tions of an angle lets start with the unit circle in the coordinate plane. sin cos By the definition of the trigonometric functions of the angle we have P(x y) P(x y) is the terminal point determined by t. Let 1x y2 be the terminal point determined by an arc of length on the unit circle. Then subtends an angle at the center of the circle. If we drop perpendicular from onto the point on the x-axis then triangle *OPQ is right triangle with legs of length and as shown in the figure. sin opp hyp cos adj hyp If is measured in radians then t. (See the figure below.) Comparing the two ways of defining the trigonometric functions we see that they are identical. In other words as functions they assign identical values to given real number. (The real number is the radian measure of in one case or the length of an arc in the other.) P(x y) P(x y) Now by the definition of the trigonometric functions of the real number we have Triangle OPQ is right triangle. The radian measure of angle is t. Why then do we study trigonometry in two dif- ferent ways? Because different applications require that we view the trigonometric functions differ- ently. (See Focus on Modeling pages 427 489 and 533 and Sections 6.2 6.5 and 6.6.) negative and is positive. Thus in Quadrant II the functions sin and csc are positive and all the other trigonometric functions have negative values. You can check the other en- tries in the following table. SIGNS OF THE TRIGONOMETRIC FUNCTIONS ll Quadrant Positive Functions Negative Functions all none II sin csc cos sec tan cot III tan cot sin csc cos sec IV cos sec sin csc tan cot angent osine You can remember this as All Students Take Calculus. We now turn our attention to finding the values of the trigonometric functions for an- gles that are not acute. EVALUATING TRIGONOMETRIC FUNCTIONS FOR ANY ANGLE FIGURE To find the values of the trigonometric functions for any angle we carry out the following steps. 1. Find the reference angle associated with the angle u. 2. Determine the sign of the trigonometric function of by noting the quadrant in which lies. 3. The value of the trigonometric function of is the same except possibly for sign as the value of the trigonometric function of Trigonometric Identities The trigonometric functions of angles are related to each other through several important equations called trigonometric identities. Weve already encountered the reciprocal identities. These identities continue to hold for any angle provided that both sides of the Areas of Triangles 13 180* We conclude this section with an application of the trigonometric functions that involves angles that are not necessarily acute. More extensive applications appear in the next two sections. The area of triangle is 12 base height If we know two sides and the in- cluded angle of triangle then we can find the height using the trigonometric functions and from this we can find the area. If is an acute angle then the height of the triangle in Figure 16(a) is given by sin u. Thus the area is 12 base height 12 ab sin If the angle is not acute then from Figure 16(b) we see that the height of the triangle is sin1180 u2 sin This is so because the reference angle of is the angle 180 u. Thus in this case also the area of the triangle is 12 base height 12 ab sin AREA OF TRIANGLE The area of triangle with sides of lengths and and with included angle is 12 ab sin ,Triangle|Triangle|Triangle|Triangle|Triangle|Triangle|Triangle|Triangle|Triangle|Triangle|Triangle|Triangle|Triangle|Triangle|Triangle|Triangle|Triangle|Calculus|Unit circle|Unit circle|Unit circle|Plane (geometry)|Sine|Sine|Sine|Sine|Sine|Sine|Sine|Sine|Sine|Sine|Sine|Sine|Sine|Sine|Focus (geometry)|Point (geometry)|Point (geometry)|Point (geometry)|Point (geometry)|Point (geometry)|Point (geometry)|Point (geometry)|Point (geometry)|Point (geometry)|Point (geometry)|Subtraction|Subtraction|Continuous function|Associative property|Trigonometric functions|Trigonometric functions|Trigonometric functions|Trigonometric functions|Trigonometric functions|Trigonometric functions|Trigonometric functions|Trigonometric functions|Trigonometric functions|Trigonometric functions|Trigonometric functions|Trigonometric functions|Trigonometric functions|Trigonometric functions|Trigonometric functions|Trigonometric functions|Trigonometric functions|Trigonometric functions|Trigonometric functions|Trigonometric functions|Trigonometric functions|Trigonometric functions|Trigonometric functions|Trigonometric functions|Trigonometric functions|Trigonometric functions|Trigonometric functions|Trigonometric functions|Trigonometric functions|Trigonometric functions|Trigonometric functions|Trigonometric functions|Trigonometric functions|Trigonometric functions|Trigonometric functions|Trigonometric functions|Trigonometric functions|Trigonometric functions|Trigonometric functions|Trigonometric functions|Trigonometric functions|Trigonometric functions|Trigonometric functions|Trigonometric functions|Trigonometric functions|Trigonometric functions|Trigonometric functions|Trigonometric functions|Trigonometric functions|Trigonometric functions|Trigonometric functions|Trigonometric functions|Trigonometric functions|Trigonometric functions|Inverse trigonometric functions|Inverse trigonometric functions|Inverse trigonometric functions|Inverse trigonometric functions|Inverse trigonometric functions|Inverse trigonometric functions|Inverse trigonometric functions|Inverse trigonometric functions|Inverse trigonometric functions|Inverse trigonometric functions|Inverse trigonometric functions|Inverse trigonometric functions|Inverse trigonometric functions|Inverse trigonometric functions|Inverse trigonometric functions|Pythagorean theorem|Circle|Circle|Circle|Circle|Identity (mathematics)|Identity (mathematics)|Identity (mathematics)|Identity (mathematics)|Identity (mathematics)|Identity (mathematics)|Identity (mathematics)|Base (exponentiation)|Base (exponentiation)|Base (exponentiation)|Angle|Angle|Angle|Angle|Angle|Angle|Angle|Angle|Angle|Angle|Angle|Angle|Angle|Angle|Angle|Angle|Angle|Angle|Angle|Angle|Angle|Angle|Angle|Angle|Angle|Angle|Angle|Angle|Angle|Angle|Angle|Angle|Angle|Multiplicative inverse|Perpendicular|Operation (mathematics)|Length|Length|Length|Length|Length|Length|Length|Sign (mathematics)|Sign (mathematics)|Sign (mathematics)|Sign (mathematics)|Sign (mathematics)|Sign (mathematics)|Sign (mathematics)|Sign (mathematics)|Sign (mathematics)|Sign (mathematics)|Sign (mathematics)|Sign (mathematics)|Sign (mathematics)|Sign (mathematics)|Equation|Universal quantification|Universal quantification|Universal quantification|Universal quantification|Universal quantification|Universal quantification|Universal quantification|Universal quantification|Exponential function|Origin (mathematics)|Coordinate system|Coordinate system|Function (mathematics)|Function (mathematics)|Function (mathematics)|Function (mathematics)|Function (mathematics)|Function (mathematics)|Function (mathematics)|Function (mathematics)|Function (mathematics)|Function (mathematics)|Function (mathematics)|Function (mathematics)|Function (mathematics)|Function (mathematics)|Function (mathematics)|Function (mathematics)|Function (mathematics)|Function (mathematics)|Function (mathematics)|Function (mathematics)|Function (mathematics)|Function (mathematics)|Function (mathematics)|Function (mathematics)|Function (mathematics)|Function (mathematics)|Function (mathematics)|Function (mathematics)|Function (mathematics)|Function (mathematics)|Function (mathematics)|Function (mathematics)|Trigonometry|Trigonometry|Trigonometry|Trigonometry|Trigonometry|Trigonometry|Trigonometry|Trigonometry|Trigonometry|Trigonometry|Trigonometry|Trigonometry|Trigonometry|Trigonometry|Trigonometry|Trigonometry|Trigonometry|Trigonometry|Trigonometry|Trigonometry|Trigonometry|Trigonometry|Trigonometry|Trigonometry|Trigonometry|Trigonometry|Trigonometry|Trigonometry|Trigonometry|Trigonometry|Trigonometry|Trigonometry|Trigonometry|Trigonometry|Trigonometry|Trigonometry|Trigonometry|Position (vector)|Position (vector)|Position (vector)|Position (vector)|Position (vector)|Position (vector)|Position (vector)|Position (vector)|Number|Number|Number|Absolute value|Absolute value|Absolute value|Linear equation|Determinant|Determinant|Determinant|Derivative|Derivative|Basis (linear algebra)|Basis (linear algebra)|Right triangle|Right triangle|Right triangle|Real number|Real number|Real number|Polygon|Distance|Distance|Area|Area|Area|Area|Area|Area|Area|Area|Quadrant (plane geometry)|Quadrant (plane geometry)|Quadrant (plane geometry)|Quadrant (plane geometry)|Quadrant (plane geometry)|Quadrant (plane geometry)|Quadrant (plane geometry)
46,46,6.4,Inverse Trigonometric Functions and Right Triangles,462,The Inverse Sine Inverse Cosine and Inverse Tangent Functions Solving for Angles in Right Triangles Evaluating Expressions Involving Inverse Trigonometric Functions The graphs of the inverse trigonometric functions are studied in Section 5.5. Recall that for function to have an inverse it must be one-to-one. Since the trigonomet- ric functions are not one-to-one they do not have inverses. So we restrict the domain of each of the trigonometric functions to intervals on which they attain all their values and on which they are one-to-one. The resulting functions have the same range as the original functions but are one-to-one. The Inverse Sine Inverse Cosine and Inverse Tangent Functions Lets first consider the sine function. We restrict the domain of the sine function to angles with p2 p2 From Figure we see that on this domain the sine function at- tains each of the values in the interval exactly once and so is one-to-one. Simi- larly we restrict the domains of cosine and tangent as shown in Figure 1. On these restricted domains we can define an inverse for each of these functions. By the definition of inverse function we have sin cos sin cos tan tan We summarize the domains and ranges of the inverse trigonometric functions in the following box. THE INVERSE SINE INVERSE COSINE AND INVERSE TANGENT FUNCTIONS The sine cosine and tangent functions on the restricted domains p2 p2 and 1p2 p2 respectively are one-to one and so have inverses. The inverse functions have domain and range as follows. Function Domain Range p2 p2 sin cos tan 1p2 p2 The functions sin cos and tan are sometimes called arcsine arccosine and arctangent respectively. Since these are inverse functions they reverse the rule of the original function. For ex- ample since sin p6 12 it follows that sin 12 p6 The following example gives fur- ther illustrations. Solving for Angles in Right Triangles In Section 6.2 we solved triangles by using the trigonometric functions to find the unknown sides. We now use the inverse trigonometric functions to solve for angles in right triangle. Evaluating Expressions Involving Inverse Trigonometric Functions Expressions like cos1sin arise in calculus. We find exact values of such expressions using trigonometric identities or right triangles. ,Triangle|Triangle|Triangle|Triangle|Triangle|Calculus|Injective function|Injective function|Injective function|Injective function|Injective function|Graph of a function|Sine|Sine|Sine|Sine|Sine|Sine|Sine|Sine|Sine|Sine|Sine|Sine|Sine|Solution of triangles|Trigonometric functions|Trigonometric functions|Trigonometric functions|Trigonometric functions|Trigonometric functions|Trigonometric functions|Trigonometric functions|Trigonometric functions|Trigonometric functions|Trigonometric functions|Trigonometric functions|Trigonometric functions|Trigonometric functions|Trigonometric functions|Trigonometric functions|Trigonometric functions|Trigonometric functions|Trigonometric functions|Trigonometric functions|Trigonometric functions|Trigonometric functions|Trigonometric functions|Trigonometric functions|Trigonometric functions|Trigonometric functions|Trigonometric functions|Trigonometric functions|Trigonometric functions|Trigonometric functions|Trigonometric functions|Trigonometric functions|Domain of a function|Domain of a function|Domain of a function|Domain of a function|Domain of a function|Domain of a function|Domain of a function|Domain of a function|Domain of a function|Inverse trigonometric functions|Inverse trigonometric functions|Inverse trigonometric functions|Inverse trigonometric functions|Inverse trigonometric functions|Inverse trigonometric functions|Inverse trigonometric functions|Identity (mathematics)|Angle|Angle|Angle|Angle|Graph (mathematics)|Interval (mathematics)|Interval (mathematics)|Universal quantification|Exponential function|Origin (mathematics)|Origin (mathematics)|Function (mathematics)|Function (mathematics)|Function (mathematics)|Function (mathematics)|Function (mathematics)|Function (mathematics)|Function (mathematics)|Function (mathematics)|Function (mathematics)|Function (mathematics)|Function (mathematics)|Function (mathematics)|Function (mathematics)|Function (mathematics)|Function (mathematics)|Function (mathematics)|Function (mathematics)|Function (mathematics)|Function (mathematics)|Function (mathematics)|Function (mathematics)|Function (mathematics)|Function (mathematics)|Function (mathematics)|Function (mathematics)|Function (mathematics)|Function (mathematics)|Trigonometry|Trigonometry|Trigonometry|Trigonometry|Trigonometry|Trigonometry|Trigonometry|Trigonometry|Right triangle|Right triangle|Right triangle|Right triangle|Expression (mathematics)|Expression (mathematics)|Expression (mathematics)|Expression (mathematics)|Range (mathematics)|Range (mathematics)|Range (mathematics)|Range (mathematics)
47,47,6.5,The Law of Sines,469,The Law of Sines The Ambiguous Case FIGURE (a) ASA or SAA In Section 6.2 we used the trigonometric ratios to solve right triangles. The trigonometric functions can also be used to solve oblique triangles that is triangles with no right an- gles. To do this we first study the Law of Sines here and then the Law of Cosines in the next section. To state these laws (or formulas) more easily we follow the convention of labeling the angles of triangle as and the lengths of the corresponding opposite sides as as in Figure 1. To solve triangle we need to know certain information about its sides and angles. To decide whether we have enough information its often helpful to make sketch. For in- stance if we are given two angles and the included side then its clear that one and only one triangle can be formed (see Figure 2(a)). Similarly if two sides and the included an- gle are known then unique triangle is determined (Figure 2(c)). But if we know all three angles and no sides we cannot uniquely determine the triangle because many triangles can have the same three angles. (All these triangles would be similar of course.) So we wont consider this last case. (b) SSA (c) SAS (d) SSS FIGURE In general triangle is determined by three of its six parts (angles and sides) as long as at least one of these three parts is side. So the possibilities illustrated in Figure are as follows. Case One side and two angles (ASA or SAA) Case Two sides and the angle opposite one of those sides (SSA) Case Two sides and the included angle (SAS) Case Three sides (SSS) Cases and are solved by using the Law of Sines Cases and require the Law of Cosines. The Law of Sines The Law of Sines says that in any triangle the lengths of the sides are proportional to the sines of the corresponding opposite angles. THE LAW OF SINES In triangle ABC we have sin sin sin The Ambiguous Case In Examples and unique triangle was determined by the information given. This is always true of Case (ASA or SAA). But in Case (SSA) there may be two triangles one triangle or no triangle with the given properties. For this reason Case is sometimes called the ambiguous case. To see why this is so we show in Figure the possibilities when angle and sides and are given. In part (a) no solution is possible since side is too short to complete the triangle. In part (b) the solution is right triangle. In part (c) two solutions are possible and in part (d) there is unique triangle with the given prop- erties. We illustrate the possibilities of Case in the following examples. ,Triangle|Triangle|Triangle|Triangle|Triangle|Triangle|Triangle|Triangle|Triangle|Triangle|Triangle|Triangle|Triangle|Triangle|Triangle|Triangle|Triangle|Triangle|Triangle|Triangle|Sine|Sine|Sine|Sine|Sine|Sine|Sine|Sine|Sine|Sine|Mereology|Mereology|Mereology|Mereology|Mereology|Mereology|Solution of triangles|Continuous function|Continuous function|Continuous function|Trigonometric functions|Trigonometric functions|Trigonometric functions|Trigonometric functions|Trigonometric functions|Trigonometric functions|Trigonometric functions|Trigonometric functions|Trigonometric functions|Trigonometric functions|Trigonometric functions|Trigonometric functions|Pythagorean theorem|Angle|Angle|Angle|Angle|Angle|Angle|Angle|Angle|Angle|Angle|Angle|Law of sines|Law of sines|Law of sines|Law of sines|Law of sines|Law of sines|Law of sines|Law of sines|Law of sines|Length|Length|Universal quantification|Universal quantification|Function (mathematics)|Trigonometry|Trigonometry|Determinant|Determinant|Determinant|Determinant|Formula|Right triangle|Right triangle|Spherical law of cosines|Spherical law of cosines|Homogeneous polynomial
48,48,6.6,The Law of Cosines,476,"The Law of Cosines Navigation: Heading and Bearing The Area of Triangle The Law of Cosines The Law of Sines cannot be used directly to solve triangles if we know two sides and the angle between them or if we know all three sides (these are Cases and of the preced- ing section). In these two cases the Law of Cosines applies. THE LAW OF COSINES In any triangle ABC (see Figure 1) we have 2bc cos 2ac cos 2ab cos In words the Law of Cosines says that the square of any side of triangle is equal to the sum of the squares of the other two sides minus twice the product of those two sides times the cosine of the included angle. If one of the angles of triangle say ""C is right angle then cos and the Law of Cosines reduces to the Pythagorean Theorem Thus the Pythagorean Theorem is special case of the Law of Cosines. Navigation: Heading and Bearing In navigation direction is often given as bearing that is as an acute angle measured from due north or due south. The bearing 30 for example indicates direction that points 30 to the east of due north (see Figure 6). The Area of Triangle An interesting application of the Law of Cosines involves formula for finding the area of triangle from the lengths of its three sides (see Figure 8). ",Triangle|Triangle|Triangle|Triangle|Triangle|Triangle|Triangle|Sine|Right angle|Solution of triangles|Point (geometry)|Continuous function|Trigonometric functions|Trigonometric functions|Trigonometric functions|Trigonometric functions|Trigonometric functions|Trigonometric functions|Trigonometric functions|Trigonometric functions|Trigonometric functions|Trigonometric functions|Trigonometric functions|Trigonometric functions|Trigonometric functions|Trigonometric functions|Product topology|Pythagorean theorem|Pythagorean theorem|Pythagorean theorem|Square (algebra)|Square (algebra)|Sum|Summation|Angle|Angle|Angle|Angle|Angle|Law of sines|Length|Universal quantification|Product (mathematics)|Multiplication|Absolute value|Matrix (mathematics)|Matrix (mathematics)|Equality (mathematics)|Formula|Empty sum|Spherical law of cosines|Spherical law of cosines|Spherical law of cosines|Spherical law of cosines|Spherical law of cosines|Spherical law of cosines|Spherical law of cosines|Spherical law of cosines|Area|Area|Area|Equality
49,49,7,ANALYTIC TRIGONOMETRY,493,In Chapters and we studied graphical and geometric properties of the trigonometric functions. In this chapter we study algebraic properties of these functions that is simplifying and factoring expressions and solving equations that involve trigonometric functions. We have used the trigonometric functions to model different real-world phenomena including periodic motion (such as the motion of an ocean wave). To obtain information from model we often need to solve equations. If the model involves trigonometric functions we need to solve trigonometric equations. Solving trigonometric equations often involves using trigonometric identities. Weve already encountered some basic trigonometric identities in the preceding chapters. We begin this chapter by finding many new identities. ,Subtraction|Algebra|Trigonometric functions|Trigonometric functions|Trigonometric functions|Trigonometric functions|Identity (mathematics)|Identity (mathematics)|Identity (mathematics)|Equation|Equation|Equation|Equation|Function (mathematics)|Function (mathematics)|Function (mathematics)|Function (mathematics)|Function (mathematics)|Trigonometry|Trigonometry|Trigonometry|Trigonometry|Trigonometry|Trigonometry|Trigonometry|Trigonometry|Equation solving|Equation solving|Equation solving|Derivative|Periodic function|Expression (mathematics)|Geometry|Factorization
